bet_id,sportsbook,type,status,odds,closing_line,ev,amount,profit,time_placed,time_settled,time_placed_iso,time_settled_iso,bet_info,tags,sports,leagues
60fa1a24-075c-46a9-ac84-d6ae3d0f63f4,ProphetX,straight,SETTLED_WIN,2.27,2.20,0.0305,24.22,30.69,12/27/2025 22:55:44 GMT,12/28/2025 04:00:00 GMT,2025-12-27T22:55:44.000Z,2025-12-28T04:00:00.000Z,"over 34.5 Lauri Markkanen Total Points, Rebounds & Assists Utah Jazz at San Antonio Spurs",,Basketball,NBA
019b6244-52bb-701b-92ed-c6278f9a3270,Novig,straight,SETTLED_LOSS,2.22,2.00,0.1111,16.9965,-17.00,12/28/2025 00:03:28 GMT,12/28/2025 02:00:00 GMT,2025-12-28T00:03:28.502Z,2025-12-28T02:00:00.000Z,Under 23.5 Anton Forsberg SAVES Anaheim Ducks @ Los Angeles Kings,,Ice Hockey,NHL
019b626b-34a1-74bc-977a-2a34fdcbd545,Novig,straight,SETTLED_WIN,2.32,2.16,0.0742,4.54274,6.00,12/28/2025 00:46:13 GMT,12/28/2025 01:05:00 GMT,2025-12-28T00:46:13.660Z,2025-12-28T01:05:00.000Z,HOU -2.5 SPREAD 1H Cleveland Cavaliers @ Houston Rockets,,Basketball,NBA
019b623d-e78f-7423-a995-e17d2bf4b3f0,Novig,straight,SETTLED_LOSS,2.20,1.98,0.1098,0.0091,-0.01,12/27/2025 23:56:26 GMT,12/28/2025 01:05:00 GMT,2025-12-27T23:56:26.567Z,2025-12-28T01:05:00.000Z,Over 10.5 AJ Green POINTS Milwaukee Bucks @ Chicago Bulls,,Basketball,NBA
019b6225-a172-78f7-a16b-946c76ce8822,Novig,straight,SETTLED_LOSS,2.21,2.10,0.0535,21.696,-21.70,12/27/2025 23:29:56 GMT,12/28/2025 01:05:00 GMT,2025-12-27T23:29:56.240Z,2025-12-28T01:05:00.000Z,Over 12.5 Matas Buzelis POINTS Milwaukee Bucks @ Chicago Bulls,,Basketball,NBA
019b622d-2aa2-79fe-86ef-87fd368bb0ef,Novig,straight,SETTLED_WIN,2.25,2.14,0.0525,22.2,27.80,12/27/2025 23:38:10 GMT,12/28/2025 01:05:00 GMT,2025-12-27T23:38:10.951Z,2025-12-28T01:05:00.000Z,Under 21.5 Trae Young POINTS New York Knicks @ Atlanta Hawks,,Basketball,NBA
019b6227-79c1-79e0-9f20-41974e941568,Novig,straight,SETTLED_WIN,2.38,2.25,0.0582,33.4992,46.26,12/27/2025 23:32:01 GMT,12/28/2025 01:05:00 GMT,2025-12-27T23:32:01.201Z,2025-12-28T01:05:00.000Z,Over 15.5 Luke Kornet POINTS REBOUNDS ASSISTS Utah Jazz @ San Antonio Spurs,,Basketball,NBA
019b622f-8f43-7b04-80f3-0ee7a474d42e,Novig,straight,SETTLED_LOSS,2.25,2.17,0.0356,20.03835,-20.04,12/27/2025 23:40:47 GMT,12/28/2025 01:05:00 GMT,2025-12-27T23:40:47.404Z,2025-12-28T01:05:00.000Z,Under 1.5 Tari Eason THREE POINTERS MADE Cleveland Cavaliers @ Houston Rockets,,Basketball,NBA
019b6234-67de-7349-aef2-5f4e4111a43e,Novig,straight,SETTLED_LOSS,2.19,2.50,-0.1247,17.19691,-17.20,12/27/2025 23:46:24 GMT,12/28/2025 01:05:00 GMT,2025-12-27T23:46:24.383Z,2025-12-28T01:05:00.000Z,Over 20.5 Kyle Kuzma POINTS REBOUNDS ASSISTS Milwaukee Bucks @ Chicago Bulls,,Basketball,NBA
019b622a-301a-7e92-9efa-2b3f69788d4a,Novig,straight,SETTLED_LOSS,2.21,2.10,0.0535,22.6,-22.60,12/27/2025 23:35:45 GMT,12/28/2025 01:05:00 GMT,2025-12-27T23:35:45.016Z,2025-12-28T01:05:00.000Z,Over 12.5 Matas Buzelis POINTS Milwaukee Bucks @ Chicago Bulls,,Basketball,NBA
019b624a-f016-772e-8d03-28008e403154,Novig,straight,SETTLED_WIN,2.10,1.97,0.0659,21.09632,23.22,12/28/2025 00:10:43 GMT,12/28/2025 01:00:00 GMT,2025-12-28T00:10:43.824Z,2025-12-28T01:00:00.000Z,Over 24.5 Tyler Huntley RUSHING YARDS Baltimore Ravens @ Green Bay Packers,,American Football,NFL
019b622b-6c41-7f10-b323-bc8d70d06be6,Novig,straight,SETTLED_LOSS,2.16,2.00,0.0799,17.19582,-17.20,12/27/2025 23:36:16 GMT,12/28/2025 00:05:00 GMT,2025-12-27T23:36:16.721Z,2025-12-28T00:05:00.000Z,Over 4.5 Derik Queen ASSISTS Phoenix Suns @ New Orleans Pelicans,,Basketball,NBA
019b622d-d854-70ad-9e8c-342e77fd9b23,Novig,straight,SETTLED_LOSS,2.16,2.55,-0.1530,24.79828,-24.80,12/27/2025 23:38:54 GMT,12/28/2025 00:05:00 GMT,2025-12-27T23:38:54.160Z,2025-12-28T00:05:00.000Z,Over 13.5 Mark Williams POINTS Phoenix Suns @ New Orleans Pelicans,,Basketball,NBA
019b611e-bc53-7873-b2c5-4e3b2f6b515c,Novig,straight,SETTLED_LOSS,1.87,1.57,0.1895,29.99745,-30.00,12/27/2025 18:42:46 GMT,12/27/2025 22:05:00 GMT,2025-12-27T18:42:46.591Z,2025-12-27T22:05:00.000Z,Under 4.5 Nique Clifford REBOUNDS Dallas Mavericks @ Sacramento Kings,,Basketball,NBA
a0995e3f-3229-49da-8aac-b626b1c8eaea,Kalshi,straight,SETTLED_LOSS,2.24,2.20,0.0164,16.1,-16.10,12/26/2025 18:31:22 GMT,12/27/2025 05:59:31 GMT,2025-12-26T18:31:22.621Z,2025-12-27T05:59:31.858Z,Portland Winner LAC at POR,,Basketball,NBA
7cb43b9e-b2f6-482d-b324-fb15df3ae6f1,ProphetX,straight,SETTLED_WIN,2.09,1.87,0.1174,4.55,4.96,12/26/2025 20:29:42 GMT,12/27/2025 03:55:30 GMT,2025-12-26T20:29:42.000Z,2025-12-27T03:55:30.269Z,"under 26.5 Derik Queen Total Points, Rebounds & Assists Phoenix Suns at New Orleans Pelicans",,Basketball,NBA
019b5c84-adc1-79e9-bb3a-f24bbf7c41bf,Novig,straight,SETTLED_WIN,2.15,2.08,0.0339,20.9994,24.16,12/26/2025 21:16:12 GMT,12/27/2025 03:05:00 GMT,2025-12-26T21:16:12.205Z,2025-12-27T03:05:00.000Z,Under 6.5 John Collins REBOUNDS Los Angeles Clippers @ Portland Trail Blazers,,Basketball,NBA
019b5bd6-b26c-7a37-ba91-e0b2612cca97,Novig,straight,SETTLED_WIN,2.35,2.68,-0.1241,21.39798,28.83,12/26/2025 18:06:02 GMT,12/27/2025 03:05:00 GMT,2025-12-26T18:06:02.789Z,2025-12-27T03:05:00.000Z,Under 20.5 John Collins POINTS REBOUNDS ASSISTS Los Angeles Clippers @ Portland Trail Blazers,,Basketball,NBA
019b5b6f-8097-7d4a-992e-17f72b36779c,Novig,straight,SETTLED_LOSS,2.25,2.18,0.0331,21.39636,-21.40,12/26/2025 16:13:15 GMT,12/27/2025 02:35:00 GMT,2025-12-26T16:13:15.632Z,2025-12-27T02:35:00.000Z,Under 10.5 Duncan Robinson POINTS Detroit Pistons @ Utah Jazz,,Basketball,NBA
019b5c55-89ac-7d0d-9758-8c60633f53de,Novig,straight,SETTLED_LOSS,2.12,1.98,0.0721,19.59831,-19.60,12/26/2025 20:24:33 GMT,12/27/2025 02:35:00 GMT,2025-12-26T20:24:33.547Z,2025-12-27T02:35:00.000Z,Under 15.5 Duncan Robinson POINTS REBOUNDS ASSISTS Detroit Pistons @ Utah Jazz,,Basketball,NBA
019b5c09-2c68-717f-8817-7e53a3b492e9,Novig,straight,SETTLED_LOSS,2.33,2.15,0.0817,15.4972,-15.50,12/26/2025 19:01:10 GMT,12/27/2025 02:35:00 GMT,2025-12-26T19:01:10.064Z,2025-12-27T02:35:00.000Z,Under 8.5 Jusuf Nurkic REBOUNDS Detroit Pistons @ Utah Jazz,,Basketball,NBA
019b5b71-2eb5-7656-a810-8d9f0ee59b27,Novig,straight,SETTLED_LOSS,2.12,2.25,-0.0584,19.09712,-19.10,12/26/2025 16:15:07 GMT,12/27/2025 01:05:00 GMT,2025-12-26T16:15:07.117Z,2025-12-27T01:05:00.000Z,Under 12.5 Mark Williams POINTS Phoenix Suns @ New Orleans Pelicans,,Basketball,NBA
019b5bfb-609b-7c56-804d-d3c3ff707d6c,Novig,straight,SETTLED_LOSS,2.03,2.20,-0.0780,26.59735,-26.60,12/26/2025 18:46:11 GMT,12/27/2025 01:05:00 GMT,2025-12-26T18:46:11.857Z,2025-12-27T01:05:00.000Z,Under 5.5 Collin Gillespie ASSISTS Phoenix Suns @ New Orleans Pelicans,,Basketball,NBA
019b5bd4-be61-7d92-809d-4e54196f57df,Novig,straight,SETTLED_WIN,2.32,1.98,0.1716,20.00702,26.41,12/26/2025 18:03:52 GMT,12/27/2025 01:05:00 GMT,2025-12-26T18:03:52.774Z,2025-12-27T01:05:00.000Z,Under 13.5 Derik Queen POINTS Phoenix Suns @ New Orleans Pelicans,,Basketball,NBA
019b5c5d-0e4c-7312-8668-358a473d03a3,Novig,straight,SETTLED_WIN,2.14,2.02,0.0589,19.99536,22.77,12/26/2025 20:32:51 GMT,12/27/2025 01:05:00 GMT,2025-12-26T20:32:51.655Z,2025-12-27T01:05:00.000Z,Under 25.5 Derik Queen POINTS REBOUNDS ASSISTS Phoenix Suns @ New Orleans Pelicans,,Basketball,NBA
019b5c67-71d7-75cb-9a18-0fe3fd8fb163,Novig,straight,SETTLED_WIN,2.14,2.00,0.0707,18.19899,20.77,12/26/2025 20:44:13 GMT,12/27/2025 00:05:00 GMT,2025-12-26T20:44:13.571Z,2025-12-27T00:05:00.000Z,Under 21.5 Desmond Bane POINTS Charlotte Hornets @ Orlando Magic,,Basketball,NBA
019b5c75-2ee8-76db-973d-e5ee66cda729,Novig,straight,SETTLED_WIN,2.14,2.00,0.0707,18.19899,20.77,12/26/2025 20:59:08 GMT,12/27/2025 00:05:00 GMT,2025-12-26T20:59:08.059Z,2025-12-27T00:05:00.000Z,Under 21.5 Desmond Bane POINTS Charlotte Hornets @ Orlando Magic,,Basketball,NBA
019b5b6f-d78e-7353-b8a7-ca9ed16e1ef9,Novig,straight,SETTLED_LOSS,2.27,,,16.69626,-16.70,12/26/2025 16:14:34 GMT,12/27/2025 00:05:00 GMT,2025-12-26T16:14:34.036Z,2025-12-27T00:05:00.000Z,Under 13.5 Tre Johnson POINTS REBOUNDS ASSISTS Toronto Raptors @ Washington Wizards,,Basketball,NBA
019b5b6f-1431-78ad-b261-7f0f2adaf949,Novig,straight,SETTLED_WIN,2.22,2.02,0.1001,25.299,30.92,12/26/2025 16:12:53 GMT,12/27/2025 00:05:00 GMT,2025-12-26T16:12:53.819Z,2025-12-27T00:05:00.000Z,Under 6.5 Jaylen Brown REBOUNDS Boston Celtics @ Indiana Pacers,,Basketball,NBA
019b5bf0-536e-7a2b-acb0-f352a2f6112e,Novig,straight,SETTLED_LOSS,2.04,2.00,0.0204,29.498,-29.50,12/26/2025 18:34:01 GMT,12/27/2025 00:05:00 GMT,2025-12-26T18:34:01.416Z,2025-12-27T00:05:00.000Z,Under 8.5 Moussa Diabate POINTS Charlotte Hornets @ Orlando Magic,,Basketball,NBA
019b5c15-c695-7f17-9ab2-e4085f4760aa,Novig,straight,SETTLED_LOSS,2.18,1.91,0.1412,18.09837,-18.10,12/26/2025 19:14:55 GMT,12/27/2025 00:05:00 GMT,2025-12-26T19:14:55.767Z,2025-12-27T00:05:00.000Z,Under 20.5 Moussa Diabate POINTS REBOUNDS ASSISTS Charlotte Hornets @ Orlando Magic,,Basketball,NBA
019b5c09-d5e6-7f31-a402-b198a5465f9a,Novig,straight,SETTLED_LOSS,2.19,1.91,0.1462,20.08972,-20.09,12/26/2025 19:01:57 GMT,12/27/2025 00:05:00 GMT,2025-12-26T19:01:57.281Z,2025-12-27T00:05:00.000Z,Under 12.5 Wendell Carter Jr. POINTS Charlotte Hornets @ Orlando Magic,,Basketball,NBA
bb32e42b-af1d-4dae-9258-7cbffa09f3f6,Kalshi,straight,SETTLED_WIN,1.55,,,22.51,12.49,12/26/2025 03:22:29 GMT,12/26/2025 07:16:00 GMT,2025-12-26T03:22:29.678Z,2025-12-26T07:16:00.855Z,Nikola Jokić: 2+ 3 Pointers Minnesota at Denver,,Basketball,NBA
6cf23d60-2ea1-4a93-b02f-7002ee5f4630,ProphetX,straight,SETTLED_LOSS,2.29,2.05,0.1156,26.2,-26.20,12/25/2025 23:30:16 GMT,12/26/2025 06:30:00 GMT,2025-12-25T23:30:16.000Z,2025-12-26T06:30:00.000Z,"under 51.5 Nikola Jokic Total Points, Rebounds & Assists Minnesota Timberwolves at Denver Nuggets",,Basketball,NBA
1385203199,PrizePicks,parlay,SETTLED_LOSS,3.00,,,10,-10.00,12/26/2025 01:02:18 GMT,12/26/2025 04:09:47 GMT,2025-12-26T01:02:18.186Z,2025-12-26T04:09:47.673Z,Over 0.5 Nikola Jokić Points DEN vs. MIN | Over 6.5 Dorian Finney-Smith Pts+Rebs+Asts HOU vs. LAL,,Basketball,NBA
1cb7d1ed-f5cd-4d51-87bc-293438872f33,Kalshi,straight,SETTLED_LOSS,2.09,,,17.67,-17.67,12/25/2025 23:01:02 GMT,12/26/2025 04:00:49 GMT,2025-12-25T23:01:02.841Z,2025-12-26T04:00:49.623Z,RJ Harvey — No Anytime Touchdown Scorer Denver at Kansas City,,American Football,NFL
2a727ae4-906b-48da-9db6-db120e2c279a,Onyx,straight,SETTLED_LOSS,1.88,1.69,0.1156,30,-30.00,12/26/2025 00:05:26 GMT,12/26/2025 03:35:08 GMT,2025-12-26T00:05:26.217Z,2025-12-26T03:35:08.946Z,Tari Eason Under 11.5 Player Points Houston Rockets @ Los Angeles Lakers,,Basketball,NBA
019b5827-582d-78a9-a136-20ddb8076a4a,Novig,straight,SETTLED_LOSS,2.43,2.25,0.0787,16.11744,-16.12,12/26/2025 00:55:45 GMT,12/26/2025 03:35:00 GMT,2025-12-26T00:55:45.998Z,2025-12-26T03:35:00.000Z,Under 12.5 Naz Reid POINTS Minnesota Timberwolves @ Denver Nuggets,,Basketball,NBA
019b5624-cc18-7c90-90bd-3799bcb88155,Novig,straight,SETTLED_LOSS,2.01,2.07,-0.0299,17.67871,-17.68,12/25/2025 15:33:37 GMT,12/26/2025 03:35:00 GMT,2025-12-25T15:33:37.352Z,2025-12-26T03:35:00.000Z,Under 3.5 Donte DiVincenzo ASSISTS Minnesota Timberwolves @ Denver Nuggets,,Basketball,NBA
5f9bc459-7de1-433c-b71c-3c830fa5a940,Kalshi,straight,SETTLED_WIN,2.73,,,9.52,16.48,12/25/2025 17:29:19 GMT,12/26/2025 01:31:00 GMT,2025-12-25T17:29:19.573Z,2025-12-26T01:31:00.003Z,Jahmyr Gibbs — No Anytime Touchdown Scorer Detroit at Minnesota,,American Football,NFL
019b5835-45fb-7e2e-b37c-3936ec58db60,Novig,straight,SETTLED_LOSS,1.76,1.61,0.0892,25.90088,-25.90,12/26/2025 01:11:05 GMT,12/26/2025 01:15:00 GMT,2025-12-26T01:11:05.618Z,2025-12-26T01:15:00.000Z,Under 4.5 Travis Kelce RECEPTIONS Denver Broncos @ Kansas City Chiefs,,American Football,NFL
019b56fd-5046-7ec2-a869-73e122f09d96,Novig,straight,SETTLED_WIN,2.17,1.93,0.1263,29.99727,35.07,12/25/2025 19:30:18 GMT,12/26/2025 01:15:00 GMT,2025-12-25T19:30:18.030Z,2025-12-26T01:15:00.000Z,Under 19.5 Hollywood Brown RECEIVING YARDS Denver Broncos @ Kansas City Chiefs,,American Football,NFL
019b581b-c1c7-74a9-9be4-4ad54932a07f,Novig,straight,SETTLED_LOSS,2.33,2.20,0.0595,14.58171,-14.58,12/26/2025 00:42:52 GMT,12/26/2025 01:05:00 GMT,2025-12-26T00:42:52.736Z,2025-12-26T01:05:00.000Z,Under 9.5 Tari Eason POINTS Houston Rockets @ Los Angeles Lakers,,Basketball,NBA
019b5815-c74f-77e7-9f98-3090a7f3c40a,Novig,straight,SETTLED_LOSS,2.36,2.20,0.0720,4.41384,-4.41,12/26/2025 00:37:02 GMT,12/26/2025 01:05:00 GMT,2025-12-26T00:37:02.018Z,2025-12-26T01:05:00.000Z,Under 9.5 Tari Eason POINTS Houston Rockets @ Los Angeles Lakers,,Basketball,NBA
019b5681-0ab6-74a8-b4f1-8ad76b59f2cc,Novig,straight,SETTLED_WIN,2.10,2.20,-0.0451,4.16976,4.59,12/25/2025 17:14:41 GMT,12/26/2025 01:05:00 GMT,2025-12-25T17:14:41.531Z,2025-12-26T01:05:00.000Z,Under 3.5 Austin Reaves REBOUNDS Houston Rockets @ Los Angeles Lakers,,Basketball,NBA
694da583ac329b0868d02686,Betr Picks,parlay,SETTLED_WIN,3.00,,,10,20.00,12/25/2025 20:58:43 GMT,12/26/2025 01:04:32 GMT,2025-12-25T20:58:43.094Z,2025-12-26T01:04:32.671Z,Over 0.5 Stephen Curry Points DAL vs. GS | Over 0.5 Cooper Flagg Blocks DAL vs. GS,,Basketball,NBA
019b5781-3d6c-7b13-92ec-d521f2401efc,Novig,straight,SETTLED_WIN,2.26,2.02,0.1200,21.29998,26.89,12/25/2025 21:54:38 GMT,12/25/2025 22:05:00 GMT,2025-12-25T21:54:38.028Z,2025-12-25T22:05:00.000Z,Under 8.5 Quinten Post POINTS Dallas Mavericks @ Golden State Warriors,,Basketball,NBA
019b5749-6fa5-7c2d-9657-b444d7d374ce,Novig,straight,SETTLED_WIN,2.00,2.00,,30,30.00,12/25/2025 20:53:24 GMT,12/25/2025 22:05:00 GMT,2025-12-25T20:53:24.060Z,2025-12-25T22:05:00.000Z,Under 28.5 Stephen Curry POINTS Dallas Mavericks @ Golden State Warriors,,Basketball,NBA
019b5638-b4fb-7c34-92c1-6cd35b393d22,Novig,straight,SETTLED_LOSS,1.91,1.95,-0.0207,2.12861,-2.13,12/25/2025 15:55:20 GMT,12/25/2025 22:05:00 GMT,2025-12-25T15:55:20.596Z,2025-12-25T22:05:00.000Z,Under 30.5 Cooper Flagg POINTS REBOUNDS ASSISTS Dallas Mavericks @ Golden State Warriors,,Basketball,NBA
019b5762-956f-734f-bba0-bbb9fa0097b3,Novig,straight,SETTLED_WIN,2.15,,,18.91155,21.76,12/25/2025 21:20:52 GMT,12/25/2025 21:30:00 GMT,2025-12-25T21:20:52.342Z,2025-12-25T21:30:00.000Z,Under 34.5 David Montgomery RUSHING YARDS Detroit Lions @ Minnesota Vikings,,American Football,NFL
2e32bca7-0d2f-4bf7-83a3-bbc4ffa833e7,Kalshi,straight,SETTLED_WIN,1.70,1.83,-0.0713,17.62,12.38,12/25/2025 16:35:56 GMT,12/25/2025 20:16:19 GMT,2025-12-25T16:35:56.821Z,2025-12-25T20:16:19.614Z,Jalen Brunson: 29+ Points Cleveland at New York,,Basketball,NBA
edde073a-3e4f-4073-96a8-f4f9fc770fde,Kalshi,straight,SETTLED_LOSS,2.34,,,20.07,-20.07,12/25/2025 16:25:37 GMT,12/25/2025 20:16:19 GMT,2025-12-25T16:25:37.308Z,2025-12-25T20:16:19.571Z,Donovan Mitchell: 30+ — No Points Cleveland at New York,,Basketball,NBA
bfde931b-7b77-4eee-ae7e-331103e2f031,Kalshi,straight,SETTLED_WIN,1.62,1.90,-0.1471,28.99,18.01,12/25/2025 16:25:17 GMT,12/25/2025 20:16:19 GMT,2025-12-25T16:25:17.573Z,2025-12-25T20:16:19.571Z,Donovan Mitchell: 30+ Points Cleveland at New York,,Basketball,NBA
f8273675-488a-4ca6-aafa-84da7507e137,ProphetX,straight,SETTLED_LOSS,2.27,2.14,0.0594,25,-25.00,12/25/2025 14:32:11 GMT,12/25/2025 20:00:00 GMT,2025-12-25T14:32:11.000Z,2025-12-25T20:00:00.000Z,"over 25.5 Mikal Bridges Total Points, Rebounds & Assists Cleveland Cavaliers at New York Knicks",,Basketball,NBA
a75ef650-e749-4eef-80a9-d54d3bd8617f,ProphetX,straight,SETTLED_WIN,1.83,1.76,0.0350,5.6,4.62,12/25/2025 16:36:21 GMT,12/25/2025 19:49:09 GMT,2025-12-25T16:36:21.000Z,2025-12-25T19:49:09.277Z,Cleveland Cavaliers +3.5 First Half Spread Cleveland Cavaliers at New York Knicks,,Basketball,NBA
019b56df-87a4-7339-bc52-9db75afdee43,Novig,straight,SETTLED_WIN,2.00,2.00,,30,30.00,12/25/2025 18:57:57 GMT,12/25/2025 19:35:00 GMT,2025-12-25T18:57:57.171Z,2025-12-25T19:35:00.000Z,Under 15.5 Chet Holmgren POINTS San Antonio Spurs @ Oklahoma City Thunder,,Basketball,NBA
019b569b-bb23-7bf6-b92b-4abaa6fe63d0,Novig,straight,SETTLED_LOSS,2.13,1.95,0.0916,19.99883,-20.00,12/25/2025 17:43:36 GMT,12/25/2025 19:35:00 GMT,2025-12-25T17:43:36.873Z,2025-12-25T19:35:00.000Z,Under 16.5 Stephon Castle POINTS San Antonio Spurs @ Oklahoma City Thunder,,Basketball,NBA
019b562a-3dd5-7ceb-beba-763beb711c62,Novig,straight,SETTLED_LOSS,2.22,2.00,0.1113,7.136080000000001,-7.14,12/25/2025 15:39:37 GMT,12/25/2025 19:35:00 GMT,2025-12-25T15:39:37.412Z,2025-12-25T19:35:00.000Z,Over 7.5 Cason Wallace POINTS San Antonio Spurs @ Oklahoma City Thunder,,Basketball,NBA
019b55e6-4705-7e8c-b03c-41e55de8b7b9,Novig,straight,SETTLED_LOSS,2.47,2.25,0.0975,19.99704,-20.00,12/25/2025 14:25:48 GMT,12/25/2025 19:35:00 GMT,2025-12-25T14:25:48.310Z,2025-12-25T19:35:00.000Z,Over 17.5 Dylan Harper POINTS REBOUNDS ASSISTS San Antonio Spurs @ Oklahoma City Thunder,,Basketball,NBA
019b55bc-2c19-7ce1-bca1-34cc2dddca86,Novig,straight,SETTLED_LOSS,2.28,2.12,0.0745,29.99687,-30.00,12/25/2025 13:39:19 GMT,12/25/2025 17:05:00 GMT,2025-12-25T13:39:19.941Z,2025-12-25T17:05:00.000Z,Under 10.5 Karl-Anthony Towns REBOUNDS Cleveland Cavaliers @ New York Knicks,,Basketball,NBA
d6db00b1-8ffd-43bf-a6e1-09cdcd2da9fa,ProphetX,straight,SETTLED_LOSS,2.08,2.05,0.0142,30,-30.00,12/24/2025 00:06:29 GMT,12/24/2025 03:30:00 GMT,2025-12-24T00:06:29.000Z,2025-12-24T03:30:00.000Z,under 10.5 Sam Merrill Points New Orleans Pelicans at Cleveland Cavaliers,,Basketball,NBA
019b4d73-6ff6-715e-8677-3c83ae8c7773,Novig,straight,SETTLED_WIN,2.25,2.18,0.0331,29.99664,37.56,12/23/2025 23:03:06 GMT,12/24/2025 03:05:00 GMT,2025-12-23T23:03:06.390Z,2025-12-24T03:05:00.000Z,Under 5.5 Keegan Murray REBOUNDS Detroit Pistons @ Sacramento Kings,,Basketball,NBA
019b4d77-ab97-75ac-b601-4267d7cfcf6a,Novig,straight,SETTLED_WIN,2.25,2.25,0.0010,29.99664,37.56,12/23/2025 23:07:30 GMT,12/24/2025 02:05:00 GMT,2025-12-23T23:07:30.564Z,2025-12-24T02:05:00.000Z,Under 2.5 Brice Sensabaugh REBOUNDS Memphis Grizzlies @ Utah Jazz,,Basketball,NBA
019b4db1-7fb3-7986-94f7-f9fe6f862dd5,Novig,straight,SETTLED_WIN,2.24,2.25,-0.0057,29.99817,37.11,12/24/2025 00:10:42 GMT,12/24/2025 02:05:00 GMT,2025-12-24T00:10:42.101Z,2025-12-24T02:05:00.000Z,Under 3.5 Jaxson Hayes REBOUNDS Los Angeles Lakers @ Phoenix Suns,,Basketball,NBA
019b4d89-35d5-70c9-bd5c-dee7cf6295df,Novig,straight,SETTLED_WIN,2.30,2.05,0.1214,29.9976,38.96,12/23/2025 23:26:39 GMT,12/24/2025 00:35:00 GMT,2025-12-23T23:26:39.652Z,2025-12-24T00:35:00.000Z,Under 3.5 De'Andre Hunter REBOUNDS New Orleans Pelicans @ Cleveland Cavaliers,,Basketball,NBA
019b4d80-df8d-717e-b2fd-97f81b814e2b,Novig,straight,SETTLED_LOSS,2.27,2.05,0.1061,28.99575,-29.00,12/23/2025 23:17:39 GMT,12/24/2025 00:35:00 GMT,2025-12-23T23:17:39.523Z,2025-12-24T00:35:00.000Z,Over 12.5 Kel'el Ware REBOUNDS Toronto Raptors @ Miami Heat,,Basketball,NBA
019b4db4-f830-719c-ab96-c75b44a017fd,Novig,straight,SETTLED_WIN,2.23,2.10,0.0629,24.9984,30.80,12/24/2025 00:14:30 GMT,12/24/2025 00:35:00 GMT,2025-12-24T00:14:30.712Z,2025-12-24T00:35:00.000Z,Under 4.5 Matas Buzelis REBOUNDS Chicago Bulls @ Atlanta Hawks,,Basketball,NBA
019b4d76-506c-798f-a039-2b14b558cb4b,Novig,straight,SETTLED_WIN,2.07,1.90,0.0892,29.99913,32.11,12/23/2025 23:06:05 GMT,12/24/2025 00:05:00 GMT,2025-12-23T23:06:05.089Z,2025-12-24T00:05:00.000Z,Over 7.5 Alexandre Sarr REBOUNDS Washington Wizards @ Charlotte Hornets,,Basketball,NBA
019b4d5e-d661-79d5-8251-d2e49d15c95e,Novig,straight,SETTLED_LOSS,2.16,2.08,0.0384,29.99777,-30.00,12/23/2025 22:40:28 GMT,12/24/2025 00:05:00 GMT,2025-12-23T22:40:28.749Z,2025-12-24T00:05:00.000Z,Under 11.5 Moussa Diabate REBOUNDS Washington Wizards @ Charlotte Hornets,,Basketball,NBA
019b48a5-68e5-706b-8b60-18f5371f0fdc,Novig,straight,SETTLED_WIN,2.08,2.20,-0.0530,30,32.50,12/23/2025 00:39:32 GMT,12/23/2025 03:05:00 GMT,2025-12-23T00:39:32.548Z,2025-12-23T03:05:00.000Z,Under 4.5 Desmond Bane REBOUNDS Orlando Magic @ Golden State Warriors,,Basketball,NBA
019b4867-37de-77a3-88e9-1a8f54001445,Novig,straight,SETTLED_LOSS,2.26,2.21,0.0237,29.99854,-30.00,12/22/2025 23:31:34 GMT,12/23/2025 00:05:00 GMT,2025-12-22T23:31:34.217Z,2025-12-23T00:05:00.000Z,Under 3.5 De'Andre Hunter REBOUNDS Charlotte Hornets @ Cleveland Cavaliers,,Basketball,NBA
d4c09388-d9bc-4349-a89b-6a79a91b95db,ProphetX,straight,SETTLED_LOSS,2.16,1.98,0.0898,30,-30.00,12/21/2025 23:03:57 GMT,12/22/2025 03:00:00 GMT,2025-12-21T23:03:57.000Z,2025-12-22T03:00:00.000Z,under 10.5 Tre Johnson Points San Antonio Spurs at Washington Wizards,,Basketball,NBA
1376261970,PrizePicks,parlay,SETTLED_LOSS,4.50,,,10,-10.00,12/21/2025 21:37:38 GMT,12/22/2025 02:00:00 GMT,2025-12-21T21:37:38.623Z,2025-12-22T02:00:00.000Z,Under 8.5 Graham Ike Rebounds GONZ vs. ORE | Under 14.5 Julian Champagnie Pts+Rebs+Asts SAS vs. WAS,,Basketball,NCAAM | NBA
019b4207-20f6-790e-8e50-21ef3f64bbf1,Novig,straight,SETTLED_WIN,2.02,2.05,-0.0145,24.9975,25.50,12/21/2025 17:48:51 GMT,12/21/2025 20:35:00 GMT,2025-12-21T17:48:51.590Z,2025-12-21T20:35:00.000Z,Under 8.5 Onyeka Okongwu REBOUNDS Chicago Bulls @ Atlanta Hawks,,Basketball,NBA
d702be0f-1574-43bb-a0c0-b9c66833d63c,ProphetX,straight,SETTLED_LOSS,2.26,2.16,0.0450,25,-25.00,12/20/2025 23:23:31 GMT,12/21/2025 06:00:00 GMT,2025-12-20T23:23:31.000Z,2025-12-21T06:00:00.000Z,under 13.5 Toumani Camara Points Portland Trail Blazers at Sacramento Kings,,Basketball,NBA
36b210eb-6642-4daa-a2e6-12f417b7a4df,Onyx,straight,SETTLED_WIN,1.98,1.94,0.0190,25.21,24.72,12/20/2025 22:00:55 GMT,12/21/2025 04:31:14 GMT,2025-12-20T22:00:55.755Z,2025-12-21T04:31:14.455Z,Sam Hauser Under 10.5 Player Points Boston Celtics @ Toronto Raptors,,Basketball,NBA
065127dc-7a88-493f-ba07-04a6ea5a9f72,ProphetX,straight,SETTLED_LOSS,2.24,2.00,0.1187,25,-25.00,12/20/2025 22:11:33 GMT,12/21/2025 03:00:00 GMT,2025-12-20T22:11:33.000Z,2025-12-21T03:00:00.000Z,under 29.5 Tyrese Maxey Points Dallas Mavericks at Philadelphia 76ers,,Basketball,NBA
f14054c1-e1a7-4303-bf8e-fb5b99180b86,ProphetX,straight,SETTLED_WIN,2.24,2.00,0.1187,23,28.46,12/20/2025 22:11:52 GMT,12/21/2025 03:00:00 GMT,2025-12-20T22:11:52.000Z,2025-12-21T03:00:00.000Z,under 21.5 Derrick White Points Boston Celtics at Toronto Raptors,,Basketball,NBA
f35756e0-98d4-4381-a4ad-471ef38c8eaf,ProphetX,straight,SETTLED_WIN,2.28,2.10,0.0843,2.67,3.41,12/20/2025 20:00:33 GMT,12/21/2025 03:00:00 GMT,2025-12-20T20:00:33.000Z,2025-12-21T03:00:00.000Z,under 19.5 Bennedict Mathurin Points Indiana Pacers at New Orleans Pelicans,,Basketball,NBA
49b05998-799a-4439-ba4a-d12e288a99be,ProphetX,straight,SETTLED_LOSS,2.17,2.16,0.0038,27,-27.00,12/20/2025 20:07:52 GMT,12/21/2025 03:00:00 GMT,2025-12-20T20:07:52.000Z,2025-12-21T03:00:00.000Z,under 18.5 Payton Pritchard Points Boston Celtics at Toronto Raptors,,Basketball,NBA
019b3d89-b7a0-7c55-9120-5e67c9eda34d,Novig,straight,SETTLED_WIN,2.12,1.91,0.1098,29.9956,33.55,12/20/2025 20:53:16 GMT,12/21/2025 00:35:00 GMT,2025-12-20T20:53:16.968Z,2025-12-21T00:35:00.000Z,Over 4.5 Kon Knueppel REBOUNDS Charlotte Hornets @ Detroit Pistons,,Basketball,NBA
019b3d6e-5d7a-7c35-8ca7-108019583a2e,Novig,straight,SETTLED_WIN,2.26,2.11,0.0722,29.99854,37.87,12/20/2025 20:23:28 GMT,12/21/2025 00:05:00 GMT,2025-12-20T20:23:28.920Z,2025-12-21T00:05:00.000Z,Under 8.5 Neemias Queta REBOUNDS Boston Celtics @ Toronto Raptors,,Basketball,NBA
019b3d87-4fa0-793d-adb9-c9ee1847ea51,Novig,straight,SETTLED_LOSS,2.18,2.07,0.0525,30.00024,-30.00,12/20/2025 20:50:54 GMT,12/21/2025 00:05:00 GMT,2025-12-20T20:50:54.715Z,2025-12-21T00:05:00.000Z,Over 9.5 Herbert Jones POINTS Indiana Pacers @ New Orleans Pelicans,,Basketball,NBA
019b3d85-0db3-76b3-b537-5730d1ef6de4,Novig,straight,SETTLED_LOSS,2.20,2.10,0.0466,29.99815,-30.00,12/20/2025 20:48:16 GMT,12/21/2025 00:05:00 GMT,2025-12-20T20:48:16.057Z,2025-12-21T00:05:00.000Z,Under 11.5 Andre Drummond REBOUNDS Dallas Mavericks @ Philadelphia 76ers,,Basketball,NBA
019b3db0-4cab-79bc-b39a-4ea7cf1b677b,Novig,straight,SETTLED_LOSS,2.15,1.94,0.1066,29.99715,-30.00,12/20/2025 21:35:29 GMT,12/20/2025 22:05:00 GMT,2025-12-20T21:35:29.556Z,2025-12-20T22:05:00.000Z,Over 11.5 Nikola Jokic REBOUNDS Houston Rockets @ Denver Nuggets,,Basketball,NBA
019b3d99-3311-7794-94a4-e78e1fa44212,Novig,straight,SETTLED_WIN,2.30,2.20,0.0449,28.9971,37.66,12/20/2025 21:10:13 GMT,12/20/2025 22:05:00 GMT,2025-12-20T21:10:13.360Z,2025-12-20T22:05:00.000Z,Under 6.5 Amen Thompson REBOUNDS Houston Rockets @ Denver Nuggets,,Basketball,NBA
10056116-d928-4b30-a529-ae3504faf0db,ProphetX,straight,SETTLED_WIN,2.29,2.15,0.0637,30,38.61,12/20/2025 13:36:08 GMT,12/20/2025 20:30:00 GMT,2025-12-20T13:36:08.000Z,2025-12-20T20:30:00.000Z,under 1.5 Anthony Beauvillier Total Shots on Goal Detroit Red Wings at Washington Capitals,,Ice Hockey,NHL
LJ6803090541W,Bet365,straight,SETTLED_WIN,1.33,,,30,9.90,12/20/2025 18:30:00 GMT,12/20/2025 18:45:00 GMT,2025-12-20T18:30:00.000Z,2025-12-20T18:45:00.000Z,Under 7.5 Total Fribourg Gotteron v ZSC Lions,,other,other
O/1509382/0000101,Fanduel Sportsbook,straight,SETTLED_WIN,1.88,,,30,26.32,12/20/2025 16:38:12 GMT,12/20/2025 16:47:53 GMT,2025-12-20T16:38:12.000Z,2025-12-20T16:47:53.000Z,Kobrat Lapua 5.5 4th Quarter Spread Kobrat Lapua v Kataja Basket,,other,other
O/1509382/0000102,Fanduel Sportsbook,straight,SETTLED_WIN,1.85,,,7.5,6.36,12/20/2025 16:39:11 GMT,12/20/2025 16:47:53 GMT,2025-12-20T16:39:11.000Z,2025-12-20T16:47:53.000Z,Kobrat Lapua 4.5 4th Quarter Spread Kobrat Lapua v Kataja Basket,,other,other
CP7401059171W,Bet365,straight,SETTLED_WIN,1.60,,,30,18.00,12/20/2025 16:09:00 GMT,12/20/2025 16:09:00 GMT,2025-12-20T16:09:00.000Z,2025-12-20T16:09:00.000Z,Over 4.5 Total Tappara v Sport,,other,other
EP9471303681W,Bet365,straight,SETTLED_WIN,1.36,,,30,10.91,12/20/2025 15:58:00 GMT,12/20/2025 16:00:00 GMT,2025-12-20T15:58:00.000Z,2025-12-20T16:00:00.000Z,Marie Vogt Money Line Victoria Bosio v Marie Vogt,,other,other
XP3784871151W,Bet365,straight,SETTLED_LOSS,1.35,,,30,-30.00,12/20/2025 15:33:00 GMT,12/20/2025 15:33:00 GMT,2025-12-20T15:33:00.000Z,2025-12-20T15:33:00.000Z,Over 3.5 Total Kookoo v Kalpa,,other,other
SP1453256891W,Bet365,straight,SETTLED_LOSS,1.38,,,30,-30.00,12/20/2025 15:14:00 GMT,12/20/2025 15:14:00 GMT,2025-12-20T15:14:00.000Z,2025-12-20T15:14:00.000Z,Over 3.5 Total Pelicans v Assat,,other,other
AP6221656281W,Bet365,straight,SETTLED_WIN,1.44,,,30,13.34,12/20/2025 15:13:00 GMT,12/20/2025 15:13:00 GMT,2025-12-20T15:13:00.000Z,2025-12-20T15:13:00.000Z,Over 0.5 Match Goals Watford v Stoke,,other,other
RP2065995251W,Bet365,straight,SETTLED_LOSS,1.44,,,30,-30.00,12/20/2025 14:49:00 GMT,12/20/2025 14:49:00 GMT,2025-12-20T14:49:00.000Z,2025-12-20T14:49:00.000Z,Over 0.5 Match Goals VfB Stuttgart v TSG Hoffenheim,,Soccer,Bundesliga
EP3052259131W,Bet365,straight,SETTLED_WIN,2.75,,,30,52.50,12/20/2025 13:37:00 GMT,12/20/2025 14:25:00 GMT,2025-12-20T13:37:00.000Z,2025-12-20T14:25:00.000Z,Taras Gil Money Line Taras Gil v Dmytro Palii,,other,other
QP6769209651W,Bet365,straight,SETTLED_WIN,3.25,,,4.65,10.47,12/20/2025 13:39:00 GMT,12/20/2025 14:25:00 GMT,2025-12-20T13:39:00.000Z,2025-12-20T14:25:00.000Z,Taras Gil Money Line Taras Gil v Dmytro Palii,,other,other
CP6690215261W,Bet365,straight,SETTLED_WIN,1.44,,,30,13.34,12/20/2025 14:24:00 GMT,12/20/2025 14:24:00 GMT,2025-12-20T14:24:00.000Z,2025-12-20T14:24:00.000Z,Over 2.5 Match Goals Eyupspor v Fenerbahce,,other,other
HP6683058791W,Bet365,straight,SETTLED_LOSS,1.40,,,30,-30.00,12/20/2025 12:42:00 GMT,12/20/2025 12:42:00 GMT,2025-12-20T12:42:00.000Z,2025-12-20T12:42:00.000Z,Over 0.5 Match Goals Notts County v Walsall,,other,other
YX1987555091W,Bet365,straight,SETTLED_WIN,1.25,,,30,7.50,12/20/2025 05:17:00 GMT,12/20/2025 06:05:00 GMT,2025-12-20T05:17:00.000Z,2025-12-20T06:05:00.000Z,Olha Kolbasenko Money Line Olha Kolbasenko v Yana Mykhailyk,,other,other
AX5210703111W,Bet365,straight,SETTLED_CASH_OUT,1.33,,,30,10.00,12/20/2025 05:17:00 GMT,12/20/2025 06:05:00 GMT,2025-12-20T05:17:00.000Z,2025-12-20T06:05:00.000Z,Olha Kolbasenko to win game 3 Current Game Money Line Olha Kolbasenko v Yana Mykhailyk,,other,other
4111653576445264158,Hard Rock Sportsbook,straight,SETTLED_LOSS,1.95,1.87,0.0443,10,-10.00,12/19/2025 22:30:33 GMT,12/20/2025 05:30:00 GMT,2025-12-19T22:30:33.515Z,2025-12-20T05:30:00.000Z,Under 3.5 Luguentz Dort - Rebounds Timberwolves vs. Thunder,,Basketball,NBA
1354705401898860831,Hard Rock Sportsbook,straight,SETTLED_LOSS,1.91,1.91,-0.0000,10,-10.00,12/19/2025 23:17:35 GMT,12/20/2025 04:24:16 GMT,2025-12-19T23:17:35.908Z,2025-12-20T04:24:16.410Z,Under 1.5 Luguentz Dort - Threes Made Timberwolves vs. Thunder,,Basketball,NBA
2487029705790456094,Hard Rock Sportsbook,straight,SETTLED_WIN,2.25,2.34,-0.0385,10,12.50,12/19/2025 21:08:29 GMT,12/20/2025 03:30:00 GMT,2025-12-19T21:08:29.072Z,2025-12-20T03:30:00.000Z,Under 2.5 Nickeil Alexander-Walker - Threes Made Hawks vs. Spurs,,Basketball,NBA
1649384982830645535,Hard Rock Sportsbook,straight,SETTLED_WIN,1.95,1.77,0.1035,10,9.52,12/19/2025 21:04:29 GMT,12/20/2025 03:30:00 GMT,2025-12-19T21:04:29.875Z,2025-12-20T03:30:00.000Z,Under 19.5 Jalen Johnson - Assists + Rebounds Hawks vs. Spurs,,Basketball,NBA
YX1591529371W,Bet365,straight,SETTLED_LOSS,1.30,,,33,-33.00,12/20/2025 03:23:00 GMT,12/20/2025 03:23:00 GMT,2025-12-20T03:23:00.000Z,2025-12-20T03:23:00.000Z,Over 5.5 Total WPG Jets @ COL Avalanche,,Ice Hockey,NHL
639017837214795746,Draftkings Sportsbook,straight,SETTLED_LOSS,1.98,1.74,0.1377,30,-30.00,12/19/2025 23:28:42 GMT,12/20/2025 03:02:30 GMT,2025-12-19T23:28:42.019Z,2025-12-20T03:02:30.067Z,Over 1.5 Lonzo Ball Three Pointers Made O/U CHI Bulls @ CLE Cavaliers,,Basketball,NBA
4880151791250702622,Hard Rock Sportsbook,straight,SETTLED_WIN,1.87,1.87,-0.0000,10,8.70,12/19/2025 23:25:21 GMT,12/20/2025 03:00:00 GMT,2025-12-19T23:25:21.345Z,2025-12-20T03:00:00.000Z,Under 2.5 Quentin Grimes - Threes Made Knicks vs. 76ers,,Basketball,NBA
f3141267-544a-4636-a0dd-5ea52e14dac1,ProphetX,straight,SETTLED_WIN,2.19,2.12,0.0321,30,35.64,12/19/2025 20:11:08 GMT,12/20/2025 03:00:00 GMT,2025-12-19T20:11:08.000Z,2025-12-20T03:00:00.000Z,under 2.5 Matthew Schaefer Total Shots on Goal Vancouver Canucks at New York Islanders,,Ice Hockey,NHL
29e4acd5-d561-43ab-80ce-72e8f09c01b0,ProphetX,straight,SETTLED_WIN,2.09,1.93,0.0847,15.51,16.89,12/19/2025 21:17:57 GMT,12/20/2025 03:00:00 GMT,2025-12-19T21:17:57.000Z,2025-12-20T03:00:00.000Z,under 15.5 Quentin Grimes Points Philadelphia 76ers at New York Knicks,,Basketball,NBA
cc5063a7-e44d-47f1-933b-812c01e19631,ProphetX,straight,SETTLED_LOSS,2.17,1.95,0.1105,30,-30.00,12/19/2025 20:10:46 GMT,12/20/2025 03:00:00 GMT,2025-12-19T20:10:46.000Z,2025-12-20T03:00:00.000Z,under 1.5 Evan Rodrigues Total Shots on Goal Carolina Hurricanes at Florida Panthers,,Ice Hockey,NHL
1360997101638254880,Hard Rock Sportsbook,straight,SETTLED_LOSS,2.30,1.97,0.1670,10,-10.00,12/19/2025 21:02:27 GMT,12/20/2025 03:00:00 GMT,2025-12-19T21:02:27.215Z,2025-12-20T03:00:00.000Z,Over 2.5 Jalen Brunson - Threes Made Knicks vs. 76ers,,Basketball,NBA
643473d8-eddb-49ae-a42b-d1c2509ebab1,ProphetX,straight,SETTLED_PUSH,2.29,,,30,0.00,12/19/2025 21:17:24 GMT,12/20/2025 02:39:14 GMT,2025-12-19T21:17:24.000Z,2025-12-20T02:39:14.079Z,under 13.5 Andrew Wiggins Points Miami Heat at Boston Celtics,,Basketball,NBA
O/1509382/0000100,Fanduel Sportsbook,straight,SETTLED_WIN,1.25,,,30,7.50,12/20/2025 02:25:56 GMT,12/20/2025 02:37:30 GMT,2025-12-20T02:25:56.000Z,2025-12-20T02:37:30.000Z,Atlanta Hawks +4.5 4th Quarter Alternate Spread San Antonio Spurs @ Atlanta Hawks,,Basketball,NBA
LH3208023151W,Bet365,straight,SETTLED_CASH_OUT,1.14,,,30,4.29,12/20/2025 00:37:00 GMT,12/20/2025 00:37:00 GMT,2025-12-20T00:37:00.000Z,2025-12-20T00:37:00.000Z,Over 2.5 Total CAR Hurricanes @ FLA Panthers,,Ice Hockey,NHL
019b38b9-899d-7c5d-b365-970ac9552a13,Novig,straight,SETTLED_LOSS,2.20,2.00,0.0989,29.99815,-30.00,12/19/2025 22:27:28 GMT,12/20/2025 00:05:00 GMT,2025-12-19T22:27:28.352Z,2025-12-20T00:05:00.000Z,Under 10.5 Karl-Anthony Towns REBOUNDS Philadelphia 76ers @ New York Knicks,,Basketball,NBA
019b38f1-d015-740f-b445-edfcbb94dcd2,Novig,straight,SETTLED_WIN,2.25,2.05,0.0987,29.99664,37.56,12/19/2025 23:28:56 GMT,12/20/2025 00:00:00 GMT,2025-12-19T23:28:56.465Z,2025-12-20T00:00:00.000Z,Under 23.5 Thatcher Demko SAVES Vancouver Canucks @ New York Islanders,,Ice Hockey,NHL
BX2314828721W,Bet365,straight,SETTLED_WIN,1.33,,,30,10.00,12/19/2025 19:49:00 GMT,12/19/2025 19:49:00 GMT,2025-12-19T19:49:00.000Z,2025-12-19T19:49:00.000Z,Over 1.5 Match Goals Borussia Dortmund v Borussia M'gladbach,,Soccer,Bundesliga
YX2786508401W,Bet365,straight,SETTLED_WIN,1.22,,,30,6.67,12/19/2025 17:52:00 GMT,12/19/2025 18:40:00 GMT,2025-12-19T17:52:00.000Z,2025-12-19T18:40:00.000Z,Artem Yurkov Money Line Vitalii S Marushchak v Artem Yurkov,,other,other
QX1044704101W,Bet365,straight,SETTLED_LOSS,1.52,,,30,-30.00,12/19/2025 18:00:00 GMT,12/19/2025 18:15:00 GMT,2025-12-19T18:00:00.000Z,2025-12-19T18:15:00.000Z,Under 4.5 Total EHC Black Wings Linz v Salzburg,,other,other
20CLJDTHCX,BetMGM,straight,SETTLED_WIN,2.05,1.87,0.0965,5,5.25,12/19/2025 01:49:36 GMT,12/19/2025 05:10:00 GMT,2025-12-19T01:49:36.763Z,2025-12-19T05:10:00.000Z,Under 12.5 Nikola Jokic (DEN) : Rebounds Orlando Magic at Denver Nuggets,,Basketball,NBA
7949732494456914207,Hard Rock Sportsbook,straight,SETTLED_WIN,2.00,2.05,-0.0244,10,10.00,12/19/2025 01:44:58 GMT,12/19/2025 05:00:00 GMT,2025-12-19T01:44:58.498Z,2025-12-19T05:00:00.000Z,Under 5.5 Goga Bitadze - Rebounds Nuggets vs. Magic,,Basketball,NBA
6186820286860230943,Hard Rock Sportsbook,straight,SETTLED_LOSS,2.05,2.00,0.0250,10,-10.00,12/19/2025 01:33:49 GMT,12/19/2025 05:00:00 GMT,2025-12-19T01:33:49.848Z,2025-12-19T05:00:00.000Z,Under 15.5 Ace Bailey - Points Jazz vs. Lakers,,Basketball,NBA
4968762888790212895,Hard Rock Sportsbook,straight,SETTLED_WIN,2.25,2.20,0.0227,10,12.50,12/19/2025 01:33:42 GMT,12/19/2025 05:00:00 GMT,2025-12-19T01:33:42.303Z,2025-12-19T05:00:00.000Z,Over 3.5 Jake LaRavia - Rebounds Jazz vs. Lakers,,Basketball,NBA
7712847181018562846,Hard Rock Sportsbook,straight,SETTLED_WIN,1.80,1.69,0.0653,10,8.00,12/19/2025 01:38:49 GMT,12/19/2025 05:00:00 GMT,2025-12-19T01:38:49.132Z,2025-12-19T05:00:00.000Z,Under 2.5 Tim Hardaway Jr. - Threes Made Nuggets vs. Magic,,Basketball,NBA
2d21fcda-df66-49a8-a2a6-4b81b754bc0d,ProphetX,straight,SETTLED_LOSS,2.24,2.05,0.0915,29,-29.00,12/19/2025 01:44:30 GMT,12/19/2025 05:00:00 GMT,2025-12-19T01:44:30.000Z,2025-12-19T05:00:00.000Z,under 1.5 Mikael Backlund Total Shots on Goal Seattle Kraken at Calgary Flames,,Ice Hockey,NHL
JH1181884051W,Bet365,straight,SETTLED_LOSS,1.36,,,30,-30.00,12/18/2025 20:28:00 GMT,12/18/2025 20:28:00 GMT,2025-12-18T20:28:00.000Z,2025-12-18T20:28:00.000Z,Over 0.5 Match Goals AZ v Jagiellonia Bialystok,,other,other
EH4317460731W,Bet365,straight,SETTLED_WIN,1.30,,,35,10.50,12/18/2025 20:11:00 GMT,12/18/2025 20:11:00 GMT,2025-12-18T20:11:00.000Z,2025-12-18T20:11:00.000Z,Over 2.5 Match Goals Sigma Olomouc v Lech Poznan,,other,other
DH6104058171W,Bet365,straight,SETTLED_LOSS,1.36,,,30,-30.00,12/18/2025 20:07:00 GMT,12/18/2025 20:07:00 GMT,2025-12-18T20:07:00.000Z,2025-12-18T20:07:00.000Z,Over 0.5 Match Goals Shakhtar Donetsk v HNK Rijeka,,other,other
YH7151554421W,Bet365,straight,SETTLED_LOSS,1.37,,,30,-30.00,12/18/2025 19:04:00 GMT,12/18/2025 19:04:00 GMT,2025-12-18T19:04:00.000Z,2025-12-18T19:04:00.000Z,Over 4.5 Total Timra IK v Skelleftea AIK,,other,other
YH6697932101W,Bet365,straight,SETTLED_CASH_OUT,1.72,,,30,21.60,12/18/2025 18:24:00 GMT,12/18/2025 18:24:00 GMT,2025-12-18T18:24:00.000Z,2025-12-18T18:24:00.000Z,Over 3.5 Total Rogle BK v Brynas IF,,other,other
DH5872103891W,Bet365,straight,SETTLED_CASH_OUT,1.25,,,40,10.00,12/18/2025 18:20:00 GMT,12/18/2025 18:20:00 GMT,2025-12-18T18:20:00.000Z,2025-12-18T18:20:00.000Z,Over 2.5 Total Linkoping HC v Djurgardens IF,,other,other
AH5171189411W,Bet365,straight,SETTLED_CASH_OUT,1.57,,,30,17.10,12/18/2025 18:19:00 GMT,12/18/2025 18:19:00 GMT,2025-12-18T18:19:00.000Z,2025-12-18T18:19:00.000Z,Over 3.5 Total Frolunda HC v HV71,,other,other
EH7126809791W,Bet365,straight,SETTLED_CASH_OUT,1.28,,,35.8,10.03,12/18/2025 17:45:00 GMT,12/18/2025 17:45:00 GMT,2025-12-18T17:45:00.000Z,2025-12-18T17:45:00.000Z,Over 2.5 Total Sparta Sarpsborg v Valerenga,,other,other
20CJZTB5PN,BetMGM,straight,SETTLED_WIN,2.05,,,30,31.50,12/17/2025 22:50:10 GMT,12/18/2025 04:30:00 GMT,2025-12-17T22:50:10.440Z,2025-12-18T04:30:00.000Z,Under 12.5 Caleb Williams (GTOWN): Points Georgetown at Marquette,,Basketball,NCAAM
20CJZTBHEJ,BetMGM,straight,SETTLED_WIN,2.00,,,30,30.00,12/17/2025 22:50:34 GMT,12/18/2025 04:30:00 GMT,2025-12-17T22:50:34.653Z,2025-12-18T04:30:00.000Z,Under 15.5 Malik Mack (GTOWN): Points Georgetown at Marquette,,Basketball,NCAAM
76abfb02-bf18-4654-941e-e51cf3676d45,ProphetX,straight,SETTLED_LOSS,2.14,2.15,-0.0053,30,-30.00,12/17/2025 22:58:26 GMT,12/18/2025 04:00:00 GMT,2025-12-17T22:58:26.000Z,2025-12-18T04:00:00.000Z,under 14.5 Donte DiVincenzo Points Memphis Grizzlies at Minnesota Timberwolves,,Basketball,NBA
7346630717817487646,Hard Rock Sportsbook,straight,SETTLED_LOSS,1.91,1.91,-0.0000,10,-10.00,12/18/2025 00:28:56 GMT,12/18/2025 04:00:00 GMT,2025-12-18T00:28:56.519Z,2025-12-18T04:00:00.000Z,Under 1.5 Kevin Huerter - Threes Made Bulls vs. Cavaliers,,Basketball,NBA
5656657156669964575,Hard Rock Sportsbook,straight,SETTLED_LOSS,2.25,2.15,0.0465,10,-10.00,12/18/2025 00:29:17 GMT,12/18/2025 04:00:00 GMT,2025-12-18T00:29:17.211Z,2025-12-18T04:00:00.000Z,Under 3.5 Jaylen Wells - Rebounds Timberwolves vs. Grizzlies,,Basketball,NBA
639016154594156405,Draftkings Sportsbook,straight,SETTLED_WIN,1.96,1.59,0.2350,25.99,24.99,12/18/2025 00:44:18 GMT,12/18/2025 04:00:00 GMT,2025-12-18T00:44:18.972Z,2025-12-18T04:00:00.000Z,Under 10.5 Vince Williams Jr. Points O/U MEM Grizzlies @ MIN Timberwolves,,Basketball,NBA
O/1509382/0000098,Fanduel Sportsbook,straight,SETTLED_WIN,2.06,2.05,0.0049,30,31.80,12/18/2025 00:40:33 GMT,12/18/2025 03:40:39 GMT,2025-12-18T00:40:33.000Z,2025-12-18T03:40:39.000Z,Cedric Coward Under 3.5 Cedric Coward - Assists Memphis Grizzlies @ Minnesota Timberwolves,,Basketball,NBA
O/1509382/0000099,Fanduel Sportsbook,straight,SETTLED_LOSS,2.20,2.12,0.0377,30,-30.00,12/18/2025 00:44:05 GMT,12/18/2025 03:40:37 GMT,2025-12-18T00:44:05.000Z,2025-12-18T03:40:37.000Z,Vince Williams Jr. Over 5.5 Vince Williams Jr. - Assists Memphis Grizzlies @ Minnesota Timberwolves,,Basketball,NBA
TX1998205951W,Bet365,straight,SETTLED_LOSS,1.36,,,30,-30.00,12/18/2025 02:21:00 GMT,12/18/2025 02:21:00 GMT,2025-12-18T02:21:00.000Z,2025-12-18T02:21:00.000Z,Over 1.5 Total WPG Jets @ STL Blues,,Ice Hockey,NHL
SX5376277631W,Bet365,straight,SETTLED_CASH_OUT,1.15,,,30,4.62,12/18/2025 01:37:00 GMT,12/18/2025 01:37:00 GMT,2025-12-18T01:37:00.000Z,2025-12-18T01:37:00.000Z,Over 2.5 Total CAR Hurricanes @ NSH Predators,,Ice Hockey,NHL
DX8885466141W,Bet365,straight,SETTLED_LOSS,1.15,,,30,-30.00,12/18/2025 01:34:00 GMT,12/18/2025 01:34:00 GMT,2025-12-18T01:34:00.000Z,2025-12-18T01:34:00.000Z,Over 2.5 Total WPG Jets @ STL Blues,,Ice Hockey,NHL
019b2ec6-edd0-7b93-9fb2-7eb8b4b263ec,Novig,straight,SETTLED_LOSS,2.22,2.02,0.1001,29.997,-30.00,12/18/2025 00:05:51 GMT,12/18/2025 01:00:00 GMT,2025-12-18T00:05:51.214Z,2025-12-18T01:00:00.000Z,Under 21.5 Pyotr Kochetkov SAVES Carolina Hurricanes @ Nashville Predators,,Ice Hockey,NHL
019b2eb6-fb27-74ca-a930-8864a4413832,Novig,straight,SETTLED_LOSS,2.18,1.98,0.1001,29.99565,-30.00,12/17/2025 23:48:30 GMT,12/18/2025 00:00:00 GMT,2025-12-17T23:48:30.985Z,2025-12-18T00:00:00.000Z,Under 22.5 Daniil Tarasov SAVES Los Angeles Kings @ Florida Panthers,,Ice Hockey,NHL
XX5461482701W,Bet365,straight,SETTLED_CASH_OUT,4.00,,,10,30.00,12/17/2025 21:03:00 GMT,12/17/2025 21:03:00 GMT,2025-12-17T21:03:00.000Z,2025-12-17T21:03:00.000Z,Over 2.5 Match Goals Newcastle v Fulham,,other,other
PX1864886411W,Bet365,straight,SETTLED_CASH_OUT,1.40,,,25,-18.00,12/17/2025 20:34:00 GMT,12/17/2025 20:34:00 GMT,2025-12-17T20:34:00.000Z,2025-12-17T20:34:00.000Z,Over 2.5 Match Goals Newcastle v Fulham,,other,other
PX5795112011W,Bet365,straight,SETTLED_WIN,1.44,,,22.5,10.00,12/17/2025 19:53:00 GMT,12/17/2025 19:53:00 GMT,2025-12-17T19:53:00.000Z,2025-12-17T19:53:00.000Z,Over 1.5 Match Goals Man City v Brentford,,other,other
SX2540557371W,Bet365,straight,SETTLED_CASH_OUT,1.40,,,25,10.00,12/17/2025 19:47:00 GMT,12/17/2025 19:47:00 GMT,2025-12-17T19:47:00.000Z,2025-12-17T19:47:00.000Z,Over 5.5 Total ZSC Lions v Lugano,,other,other
GX6634770051W,Bet365,straight,SETTLED_WIN,1.36,,,27.5,10.00,12/17/2025 19:46:00 GMT,12/17/2025 19:46:00 GMT,2025-12-17T19:46:00.000Z,2025-12-17T19:46:00.000Z,Over 0.5 Match Goals FC Zurich v Lugano,,other,other
QX8969407341W,Bet365,straight,SETTLED_WIN,1.40,,,25,10.00,12/17/2025 18:28:00 GMT,12/17/2025 18:45:00 GMT,2025-12-17T18:28:00.000Z,2025-12-17T18:45:00.000Z,Under 6.5 Total Fribourg Gotteron v HC Ajoie,,other,other
BX4142819041W,Bet365,straight,SETTLED_LOSS,1.28,,,35.8,-35.80,12/17/2025 18:28:00 GMT,12/17/2025 18:28:00 GMT,2025-12-17T18:28:00.000Z,2025-12-17T18:28:00.000Z,Over 2.5 Total Frederikshavn Whitehawks v Herlev Eagles,,other,other
TX6911567341W,Bet365,straight,SETTLED_CASH_OUT,1.73,,,13.8,0.00,12/17/2025 15:38:00 GMT,12/17/2025 16:40:00 GMT,2025-12-17T15:38:00.000Z,2025-12-17T16:40:00.000Z,Oleg Varlamov Money Line Daniil Habrelyan v Oleg Varlamov,,other,other
GX6430674151W,Bet365,straight,SETTLED_WIN,1.44,,,22.5,10.00,12/17/2025 15:12:00 GMT,12/17/2025 16:00:00 GMT,2025-12-17T15:12:00.000Z,2025-12-17T16:00:00.000Z,Oleksandr Shkurupii Money Line Oleksandr Shkurupii v Oleksandr Zhurba,,other,other
PX8941589581W,Bet365,straight,SETTLED_WIN,2.25,,,12.5,15.63,12/17/2025 15:17:00 GMT,12/17/2025 16:00:00 GMT,2025-12-17T15:17:00.000Z,2025-12-17T16:00:00.000Z,Oleksandr Shkurupii Money Line Oleksandr Shkurupii v Oleksandr Zhurba,,other,other
FX3851780151W,Bet365,straight,SETTLED_LOSS,1.40,,,25,-25.00,12/17/2025 14:42:00 GMT,12/17/2025 15:30:00 GMT,2025-12-17T14:42:00.000Z,2025-12-17T15:30:00.000Z,Dmytro Neborak Money Line Dmytro Neborak v Anton Tur,,other,other
PX9411633871W,Bet365,straight,SETTLED_WIN,1.33,,,30,10.00,12/17/2025 13:27:00 GMT,12/17/2025 14:15:00 GMT,2025-12-17T13:27:00.000Z,2025-12-17T14:15:00.000Z,Tomas Liska Money Line Jakub Senk v Tomas Liska,,other,other
PX2828598891W,Bet365,straight,SETTLED_WIN,2.25,,,30,37.50,12/17/2025 13:41:00 GMT,12/17/2025 14:15:00 GMT,2025-12-17T13:41:00.000Z,2025-12-17T14:15:00.000Z,Tomas Liska Money Line Jakub Senk v Tomas Liska,,other,other
04c37859-a0fd-4bcc-aef9-c3c5944bb399,ProphetX,straight,SETTLED_WIN,2.29,2.10,0.0890,29,37.32,12/17/2025 02:10:33 GMT,12/17/2025 06:00:00 GMT,2025-12-17T02:10:33.000Z,2025-12-17T06:00:00.000Z,under 1.5 Joel Farabee Total Shots on Goal Calgary Flames at San Jose Sharks,,Ice Hockey,NHL
7345732175762555168,Hard Rock Sportsbook,straight,SETTLED_WIN,2.10,1.95,0.0756,10,11.00,12/17/2025 01:00:17 GMT,12/17/2025 04:30:00 GMT,2025-12-17T01:00:17.272Z,2025-12-17T04:30:00.000Z,Over 9.5 Jalen Brunson - Assists + Rebounds Knicks vs. Spurs,,Basketball,NBA
SX4852311951W,Bet365,straight,SETTLED_WIN,1.65,,,31,20.00,12/17/2025 02:21:00 GMT,12/17/2025 02:21:00 GMT,2025-12-17T02:21:00.000Z,2025-12-17T02:21:00.000Z,Over 4.5 Total WAS Capitals @ MIN Wild,,Ice Hockey,NHL
EX7784048501W,Bet365,straight,SETTLED_WIN,1.29,,,35,10.00,12/17/2025 01:32:00 GMT,12/17/2025 01:32:00 GMT,2025-12-17T01:32:00.000Z,2025-12-17T01:32:00.000Z,Over 4.5 Total PHI Flyers @ MTL Canadiens,,Ice Hockey,NHL
PX6418381221W,Bet365,straight,SETTLED_CASH_OUT,1.13,,,30,4.00,12/17/2025 00:33:00 GMT,12/17/2025 00:33:00 GMT,2025-12-17T00:33:00.000Z,2025-12-17T00:33:00.000Z,Over 2.5 Total NY Islanders @ DET Red Wings,,Ice Hockey,NHL
PE3872197271W,Bet365,straight,SETTLED_WIN,1.44,,,22.5,10.00,12/16/2025 21:01:00 GMT,12/16/2025 21:01:00 GMT,2025-12-16T21:01:00.000Z,2025-12-16T21:01:00.000Z,Over 0.5 Match Goals CD Guadalajara S.A.D. v Barcelona,,other,other
YH1302237231W,Bet365,straight,SETTLED_CASH_OUT,1.57,,,14,8.00,12/16/2025 20:17:00 GMT,12/16/2025 20:17:00 GMT,2025-12-16T20:17:00.000Z,2025-12-16T20:17:00.000Z,Over 0.5 Match Goals Eldense v Real Sociedad,,other,other
PH7356087741W,Bet365,straight,SETTLED_CASH_OUT,1.25,,,15,-1.25,12/16/2025 20:15:00 GMT,12/16/2025 20:15:00 GMT,2025-12-16T20:15:00.000Z,2025-12-16T20:15:00.000Z,Over 1.5 Match Goals Cardiff v Chelsea,,other,other
HH7498263551W,Bet365,straight,SETTLED_CASH_OUT,1.40,,,25,10.00,12/16/2025 20:11:00 GMT,12/16/2025 20:11:00 GMT,2025-12-16T20:11:00.000Z,2025-12-16T20:11:00.000Z,Over 0.5 Match Goals Eldense v Real Sociedad,,other,other
FH9164626121W,Bet365,straight,SETTLED_CASH_OUT,1.33,,,30,10.00,12/16/2025 20:06:00 GMT,12/16/2025 20:06:00 GMT,2025-12-16T20:06:00.000Z,2025-12-16T20:06:00.000Z,Over 0.5 Match Goals Eldense v Real Sociedad,,other,other
HH9780190901W,Bet365,straight,SETTLED_CASH_OUT,1.53,,,30,16.00,12/16/2025 19:53:00 GMT,12/16/2025 19:53:00 GMT,2025-12-16T19:53:00.000Z,2025-12-16T19:53:00.000Z,Over 2.5 Match Goals St Gallen v FC Sion,,other,other
LH4036001421W,Bet365,straight,SETTLED_PUSH,1.42,,,50,0.00,12/16/2025 19:53:00 GMT,12/16/2025 19:53:00 GMT,2025-12-16T19:53:00.000Z,2025-12-16T19:53:00.000Z,Over 3.5 Total Zug v Lukko,,other,other
GD4588582441W,Bet365,straight,SETTLED_CASH_OUT,1.58,,,30,17.40,12/16/2025 16:54:00 GMT,12/16/2025 16:54:00 GMT,2025-12-16T16:54:00.000Z,2025-12-16T16:54:00.000Z,Over 3.5 Total Kalpa v Brynas IF,,other,other
6211127890897797408,Hard Rock Sportsbook,straight,SETTLED_LOSS,2.30,2.30,,10,-10.00,12/15/2025 22:45:43 GMT,12/16/2025 05:30:00 GMT,2025-12-15T22:45:43.106Z,2025-12-16T05:30:00.000Z,Under 11.5 Amen Thompson - Assists + Rebounds Nuggets vs. Rockets,,Basketball,NBA
20CG96X9AN,BetMGM,straight,SETTLED_LOSS,1.91,1.74,0.0967,30,-30.00,12/16/2025 00:38:03 GMT,12/16/2025 04:14:34 GMT,2025-12-16T00:38:03.657Z,2025-12-16T04:14:34.486Z,Under 7.5 Lauri Markkanen (UTA): Rebounds Dallas Mavericks at Utah Jazz,,Basketball,NBA
20CG9E66JM,BetMGM,straight,SETTLED_WIN,1.91,1.71,0.1136,30,27.27,12/16/2025 00:46:01 GMT,12/16/2025 04:14:34 GMT,2025-12-16T00:46:01.497Z,2025-12-16T04:14:34.485Z,Over 2.5 Klay Thompson (DAL): Three-pointers made Dallas Mavericks at Utah Jazz,,Basketball,NBA
O/1509382/0000097,Fanduel Sportsbook,straight,SETTLED_WIN,1.28,,,30,8.33,12/16/2025 02:50:04 GMT,12/16/2025 03:12:51 GMT,2025-12-16T02:50:04.000Z,2025-12-16T03:12:51.000Z,Over 3.5 Alternate Total Goals Ottawa Senators @ Winnipeg Jets,,Ice Hockey,NHL
edf1c5ed-a4b0-45fd-a892-fbd1e0a5494d,ProphetX,straight,SETTLED_WIN,2.12,2.20,-0.0370,30,33.56,12/15/2025 22:33:07 GMT,12/16/2025 03:05:10 GMT,2025-12-15T22:33:07.000Z,2025-12-16T03:05:10.578Z,under 15.5 Andrew Wiggins Points Toronto Raptors at Miami Heat,,Basketball,NBA
29546e84-653a-41fd-b912-1e57a65c7668,ProphetX,straight,SETTLED_LOSS,2.09,1.96,0.0650,28,-28.00,12/15/2025 20:47:34 GMT,12/16/2025 03:05:10 GMT,2025-12-15T20:47:34.000Z,2025-12-16T03:05:10.577Z,under 23.5 Brandon Ingram Points Toronto Raptors at Miami Heat,,Basketball,NBA
2418715955153338655,Hard Rock Sportsbook,straight,SETTLED_LOSS,2.25,2.14,0.0514,10,-10.00,12/15/2025 22:49:25 GMT,12/16/2025 03:05:06 GMT,2025-12-15T22:49:25.346Z,2025-12-16T03:05:06.653Z,Under 2.5 Ochai Agbaji - Rebounds Heat vs. Raptors,,Basketball,NBA
20CG5CTZJZ,BetMGM,straight,SETTLED_WIN,1.91,1.71,0.1136,30,27.27,12/15/2025 22:36:09 GMT,12/16/2025 03:05:06 GMT,2025-12-15T22:36:09.117Z,2025-12-16T03:05:06.541Z,Under 2.5 Anfernee Simons (BOS): Assists Detroit Pistons at Boston Celtics,,Basketball,NBA
639014502168297735,Draftkings Sportsbook,straight,SETTLED_WIN,1.33,,,30,10.00,12/16/2025 02:50:17 GMT,12/16/2025 03:02:09 GMT,2025-12-16T02:50:17.995Z,2025-12-16T03:02:09.697Z,Over 3.5 Live Alternate Total Goals OTT Senators @ WPG Jets,,Ice Hockey,NHL
4388095572905296159,Hard Rock Sportsbook,straight,SETTLED_WIN,2.15,1.96,0.0961,10,11.50,12/15/2025 23:27:22 GMT,12/16/2025 03:00:00 GMT,2025-12-15T23:27:22.440Z,2025-12-16T03:00:00.000Z,Under 14.5 Cade Cunningham - Assists + Rebounds Celtics vs. Pistons,,Basketball,NBA
1810538881561133342,Hard Rock Sportsbook,straight,SETTLED_WIN,2.20,1.94,0.1320,10,12.00,12/15/2025 20:00:39 GMT,12/16/2025 03:00:00 GMT,2025-12-15T20:00:39.214Z,2025-12-16T03:00:00.000Z,Under 2.5 Duncan Robinson - Rebounds Celtics vs. Pistons,,Basketball,NBA
O/1509382/0000096,Fanduel Sportsbook,straight,SETTLED_CASH_OUT,1.67,,,15,-7.29,12/16/2025 02:32:55 GMT,12/16/2025 02:47:45 GMT,2025-12-16T02:32:55.000Z,2025-12-16T02:47:45.000Z,Over 1.5 3rd Period Alt Total Goals Ottawa Senators @ Winnipeg Jets,,Ice Hockey,NHL
O/1509382/0000095,Fanduel Sportsbook,straight,SETTLED_LOSS,2.58,,,10,-10.00,12/16/2025 02:26:25 GMT,12/16/2025 02:37:30 GMT,2025-12-16T02:26:25.000Z,2025-12-16T02:37:30.000Z,Under 3.5 Total Goals Anaheim Ducks @ New York Rangers,,Ice Hockey,NHL
20CG5L2AG9,BetMGM,straight,SETTLED_LOSS,2.30,2.14,0.0748,30,-30.00,12/15/2025 22:44:40 GMT,12/16/2025 02:25:24 GMT,2025-12-15T22:44:40.113Z,2025-12-16T02:25:24.049Z,Under 2.5 Ochai Agbaji (TOR) : Rebounds Toronto Raptors at Miami Heat,,Basketball,NBA
8520965297006182688,Hard Rock Sportsbook,straight,SETTLED_LOSS,2.15,2.15,,10,-10.00,12/16/2025 00:08:40 GMT,12/16/2025 02:24:48 GMT,2025-12-16T00:08:40.800Z,2025-12-16T02:24:48.505Z,Under 2.5 Immanuel Quickley - Threes Made Heat vs. Raptors,,Basketball,NBA
3146849156777902366,Hard Rock Sportsbook,straight,SETTLED_VOID,1.87,,,10,0.00,12/15/2025 23:49:20 GMT,12/16/2025 00:36:14 GMT,2025-12-15T23:49:20.428Z,2025-12-16T00:36:14.260Z,Under 2.5 Tyler Herro - Threes Made Heat vs. Raptors,,Basketball,NBA
019b2469-4c93-7529-b413-634c64fc8a8f,Novig,straight,SETTLED_VOID,2.23,,,29.99808,0.00,12/15/2025 23:47:23 GMT,12/16/2025 00:35:00 GMT,2025-12-15T23:47:23.939Z,2025-12-16T00:35:00.000Z,Under 4.5 Tyler Herro REBOUNDS Toronto Raptors @ Miami Heat,,Basketball,NBA
019b243c-d9b0-724a-83c3-f5c408b9269e,Novig,straight,SETTLED_WIN,2.16,1.95,0.1063,29.99777,34.79,12/15/2025 22:59:10 GMT,12/16/2025 00:05:00 GMT,2025-12-15T22:59:10.979Z,2025-12-16T00:05:00.000Z,Under 11.5 Jalen Duren REBOUNDS Detroit Pistons @ Boston Celtics,,Basketball,NBA
019b239a-2763-7ade-a2a6-0666f7401ee3,Novig,straight,SETTLED_WIN,2.24,2.00,0.1211,29.99796,37.26,12/15/2025 20:01:07 GMT,12/16/2025 00:00:00 GMT,2025-12-15T20:01:07.554Z,2025-12-16T00:00:00.000Z,Under 24.5 Jonas Johansson SAVES Florida Panthers @ Tampa Bay Lightning,,Ice Hockey,NHL
O/1509382/0000094,Fanduel Sportsbook,straight,SETTLED_CASH_OUT,2.18,2.10,0.0381,30,0.00,12/15/2025 22:17:39 GMT,12/15/2025 22:18:03 GMT,2025-12-15T22:17:39.000Z,2025-12-15T22:18:03.000Z,Anthony Cirelli - Under 1.5 Anthony Cirelli Shots on Goal Florida Panthers @ Tampa Bay Lightning,,Ice Hockey,NHL
693f158ac505e86c3ffceab7,Betr Picks,parlay,SETTLED_LOSS,3.25,,,30,-30.00,12/14/2025 19:52:42 GMT,12/15/2025 04:10:35 GMT,2025-12-14T19:52:42.638Z,2025-12-15T04:10:35.740Z,Under 18.5 Tristan Vukcevic Pts+Rebs+Asst WAS vs. IND | Under 4.5 Royce O'Neale Rebounds LAL vs. PHO,,Basketball,NBA
1645980145560584479,Hard Rock Sportsbook,straight,SETTLED_WIN,1.91,1.91,-0.0000,10,9.09,12/13/2025 23:08:37 GMT,12/15/2025 04:00:00 GMT,2025-12-13T23:08:37.839Z,2025-12-15T04:00:00.000Z,Under 8.5 Mark Williams - Rebounds Suns vs. Lakers,,Basketball,NBA
20CENC97TB,BetMGM,straight,SETTLED_LOSS,2.05,1.92,0.0691,25,-25.00,12/14/2025 21:32:12 GMT,12/15/2025 03:59:36 GMT,2025-12-14T21:32:12.013Z,2025-12-15T03:59:36.099Z,Under 5.5 Marcus Smart (LAL): Total assists and rebounds Los Angeles Lakers at Phoenix Suns,,Basketball,NBA
7777608635676098847,Hard Rock Sportsbook,straight,SETTLED_WIN,2.25,2.00,0.1250,10,12.50,12/13/2025 23:07:49 GMT,12/15/2025 03:59:22 GMT,2025-12-13T23:07:49.369Z,2025-12-15T03:59:22.792Z,Under 1.5 Marcus Smart - Threes Made Suns vs. Lakers,,Basketball,NBA
9062972225723564319,Hard Rock Sportsbook,straight,SETTLED_LOSS,2.00,2.05,-0.0244,10,-10.00,12/13/2025 23:09:06 GMT,12/15/2025 03:59:22 GMT,2025-12-13T23:09:06.174Z,2025-12-15T03:59:22.790Z,Under 9.5 Devin Booker - Assists + Rebounds Suns vs. Lakers,,Basketball,NBA
1799621555194167582,Hard Rock Sportsbook,straight,SETTLED_LOSS,1.87,1.77,0.0567,10,-10.00,12/14/2025 20:09:44 GMT,12/15/2025 03:00:00 GMT,2025-12-14T20:09:44.304Z,2025-12-15T03:00:00.000Z,Under 4.5 Donte DiVincenzo - Rebounds Timberwolves vs. Kings,,Basketball,NBA
cdcef89a-824d-495b-803f-b07f9b7c0342,ProphetX,straight,SETTLED_WIN,2.23,1.98,0.1248,26,31.92,12/14/2025 21:10:28 GMT,12/15/2025 01:40:31 GMT,2025-12-14T21:10:28.000Z,2025-12-15T01:40:31.220Z,under 19.5 Nickeil Alexander-Walker Points Philadelphia 76ers at Atlanta Hawks,,Basketball,NBA
6278818568683127072,Hard Rock Sportsbook,straight,SETTLED_LOSS,1.95,1.87,0.0443,10,-10.00,12/13/2025 23:08:21 GMT,12/15/2025 01:40:25 GMT,2025-12-13T23:08:21.242Z,2025-12-15T01:40:25.312Z,Under 3.5 Terance Mann - Rebounds Nets vs. Bucks,,Basketball,NBA
3648479674746274080,Hard Rock Sportsbook,straight,SETTLED_WIN,2.00,1.91,0.0476,10,10.00,12/14/2025 22:08:07 GMT,12/15/2025 01:40:25 GMT,2025-12-14T22:08:07.966Z,2025-12-15T01:40:25.309Z,Under 10.5 Ryan Rollins - Assists + Rebounds Nets vs. Bucks,,Basketball,NBA
20CEKSM1HS,BetMGM,straight,SETTLED_WIN,2.05,1.80,0.1389,30,31.50,12/14/2025 20:09:08 GMT,12/14/2025 23:40:00 GMT,2025-12-14T20:09:08.417Z,2025-12-14T23:40:00.000Z,Under 4.5 Kon Knueppel (CHA): Assists Charlotte Hornets at Cleveland Cavaliers,,Basketball,NBA
20CEKSM1FY,BetMGM,straight,SETTLED_WIN,2.05,1.91,0.0738,30,31.50,12/14/2025 20:09:08 GMT,12/14/2025 23:40:00 GMT,2025-12-14T20:09:08.407Z,2025-12-14T23:40:00.000Z,Under 9.5 Kon Knueppel (CHA): Total assists and rebounds Charlotte Hornets at Cleveland Cavaliers,,Basketball,NBA
20CEKSME6K,BetMGM,straight,SETTLED_LOSS,2.05,2.05,,30,-30.00,12/14/2025 20:09:21 GMT,12/14/2025 23:40:00 GMT,2025-12-14T20:09:21.380Z,2025-12-14T23:40:00.000Z,Under 11.5 Miles Bridges (CHA) : Total assists and rebounds Charlotte Hornets at Cleveland Cavaliers,,Basketball,NBA
693f29b564222120af4b442c,Betr Picks,parlay,SETTLED_LOSS,4.00,,,10,-10.00,12/14/2025 21:18:45 GMT,12/14/2025 23:34:02 GMT,2025-12-14T21:18:45.167Z,2025-12-14T23:34:02.061Z,Under 5.5 CJ McCollum Rebounds WAS vs. IND | Under 3.5 Donovan Mitchell 3PT Made CHA vs. CLE,,Basketball,NBA
577735984053748000,Hard Rock Sportsbook,straight,SETTLED_LOSS,1.83,1.88,-0.0274,10,-10.00,12/14/2025 19:38:21 GMT,12/14/2025 23:30:00 GMT,2025-12-14T19:38:21.952Z,2025-12-14T23:30:00.000Z,Under 4.5 Dean Wade - Rebounds Cavaliers vs. Hornets,,Basketball,NBA
3192578263599546654,Hard Rock Sportsbook,straight,SETTLED_WIN,1.87,1.63,0.1449,10,8.70,12/14/2025 17:08:17 GMT,12/14/2025 23:30:00 GMT,2025-12-14T17:08:17.733Z,2025-12-14T23:30:00.000Z,Under 4.5 De'Andre Hunter - Rebounds Cavaliers vs. Hornets,,Basketball,NBA
019b1975-ec51-7346-82ae-9397d28ce5ed,Novig,straight,SETTLED_WIN,2.08,2.00,0.0395,26.99853,29.13,12/13/2025 20:45:21 GMT,12/14/2025 23:05:00 GMT,2025-12-13T20:45:21.624Z,2025-12-14T23:05:00.000Z,Under 12.5 Kevin Porter Jr. REBOUNDS ASSISTS Milwaukee Bucks @ Brooklyn Nets,,Basketball,NBA
5225406977948778783,Hard Rock Sportsbook,straight,SETTLED_LOSS,2.15,2.08,0.0337,10,-10.00,12/14/2025 18:59:21 GMT,12/14/2025 23:00:00 GMT,2025-12-14T18:59:21.332Z,2025-12-14T23:00:00.000Z,Under 9.5 Tre Johnson - Points Pacers vs. Wizards,,Basketball,NBA
6b04bc9b-ff71-465e-a28d-8c52ca17da1d,Dabble,parlay,SETTLED_WIN,3.00,3.73,-0.1951,10,20.00,12/11/2025 06:16:37 GMT,12/14/2025 20:38:03 GMT,2025-12-11T06:16:37.982Z,2025-12-14T20:38:03.745Z,Under 5.5 Shaedon Sharpe rebounds Portland Trail Blazers @ New Orleans Pelicans | Under 18.5 Jalen Hurts passing-completions Las Vegas Raiders @ Philadelphia Eagles,,Basketball | American Football,NBA | NFL
3e69c969-f0c7-4d11-9c44-66c20132928e,ProphetX,straight,SETTLED_WIN,2.25,2.05,0.0963,30,37.42,12/14/2025 17:08:32 GMT,12/14/2025 20:10:08 GMT,2025-12-14T17:08:32.000Z,2025-12-14T20:10:08.615Z,under 1.5 Stefan Noesen Total Shots on Goal Vancouver Canucks at New Jersey Devils,,Ice Hockey,NHL
20CD3EY92S,BetMGM,straight,SETTLED_LOSS,2.00,1.91,0.0476,23,-23.00,12/13/2025 18:22:29 GMT,12/14/2025 07:30:00 GMT,2025-12-13T18:22:29.523Z,2025-12-14T07:30:00.000Z,Under 16.5 Graham Ike (GON) : Points UCLA at Gonzaga (Neutral Venue),,Basketball,NCAAM
1d6eb9b6-340f-46a8-bc92-a5b217e5ae6c,ProphetX,straight,SETTLED_LOSS,2.12,1.98,0.0698,26,-26.00,12/14/2025 01:51:45 GMT,12/14/2025 06:00:00 GMT,2025-12-14T01:51:45.000Z,2025-12-14T06:00:00.000Z,under 1.5 Mikael Backlund Total Shots on Goal Calgary Flames at Los Angeles Kings,,Ice Hockey,NHL
O/1509382/0000093,Fanduel Sportsbook,straight,SETTLED_LOSS,2.00,1.68,0.1935,10,-10.00,12/14/2025 00:08:11 GMT,12/14/2025 05:05:55 GMT,2025-12-14T00:08:11.000Z,2025-12-14T05:05:55.000Z,Jalen Williams Under 1.5 Jalen Williams - Made Threes San Antonio Spurs @ Oklahoma City Thunder,,Basketball,NBA
13545969662,Bally Bet,straight,SETTLED_WIN,1.86,1.70,0.0946,4.09,3.52,12/13/2025 18:19:19 GMT,12/14/2025 05:00:00 GMT,2025-12-13T18:19:19.690Z,2025-12-14T05:00:00.000Z,Ryan O'Reilly Under 1.5 Shots on goal by the player - Inc. OT: Ryan O'Reilly NSH Predators at COL Avalanche,,Ice Hockey,NHL
5683836102775669022,Hard Rock Sportsbook,straight,SETTLED_WIN,1.83,1.66,0.1058,10,8.33,12/13/2025 18:16:26 GMT,12/14/2025 05:00:00 GMT,2025-12-13T18:16:26.511Z,2025-12-14T05:00:00.000Z,Under 9.5 Ajay Mitchell - Points Thunder vs. Spurs,,Basketball,NBA
3163806435322364190,Hard Rock Sportsbook,straight,SETTLED_LOSS,1.91,1.68,0.1330,10,-10.00,12/13/2025 22:46:39 GMT,12/14/2025 04:49:53 GMT,2025-12-13T22:46:39.975Z,2025-12-14T04:49:53.882Z,Under 4.5 Keldon Johnson - Rebounds Thunder vs. Spurs,,Basketball,NBA
19035015-67f0-4c57-b08a-250baeee97dc,ProphetX,straight,SETTLED_WIN,2.09,1.94,0.0749,24,26.14,12/13/2025 22:47:55 GMT,12/14/2025 04:00:00 GMT,2025-12-13T22:47:55.000Z,2025-12-14T04:00:00.000Z,under 2.5 Carter Verhaeghe Total Shots on Goal Florida Panthers at Dallas Stars,,Ice Hockey,NHL
13546798453,Bally Bet,straight,SETTLED_WIN,1.87,1.75,0.0709,4.04,3.51,12/13/2025 20:23:36 GMT,12/14/2025 04:00:00 GMT,2025-12-13T20:23:36.120Z,2025-12-14T04:00:00.000Z,Artyom Levshunov Under 1.5 Shots on goal by the player - Inc. OT: Artyom Levshunov DET Red Wings at CHI Blackhawks,,Ice Hockey,NHL
20CDD09X6A,BetMGM,straight,SETTLED_WIN,2.30,1.90,0.2100,5,6.50,12/13/2025 23:28:47 GMT,12/14/2025 03:30:00 GMT,2025-12-13T23:28:47.703Z,2025-12-14T03:30:00.000Z,Under 15.5 Tucker DeVries (IND): Points Indiana U. at Kentucky,,Basketball,NCAAM
20CDD1B062,BetMGM,straight,SETTLED_WIN,2.30,1.90,0.2100,25,32.50,12/13/2025 23:29:37 GMT,12/14/2025 03:30:00 GMT,2025-12-13T23:29:37.867Z,2025-12-14T03:30:00.000Z,Under 15.5 Tucker DeVries (IND): Points Indiana U. at Kentucky,,Basketball,NCAAM
2178703332480909599,Hard Rock Sportsbook,straight,SETTLED_WIN,2.10,2.10,,10,11.00,12/13/2025 21:06:29 GMT,12/14/2025 01:24:59 GMT,2025-12-13T21:06:29.715Z,2025-12-14T01:24:59.562Z,Under 2.5 Jalen Brunson - Threes Made Magic vs. Knicks,,Basketball,NBA
20CD9C7RW6,BetMGM,straight,SETTLED_WIN,2.10,,,22,24.20,12/13/2025 21:32:36 GMT,12/14/2025 01:24:59 GMT,2025-12-13T21:32:36.237Z,2025-12-14T01:24:59.336Z,Under 8.5 Matt Able (NCST) : Points Kansas at NC State,,Basketball,NCAAM
PlacedBet:ueShCjNzoVMYk7wdxleShjcnOaQ=,theScore Bet,straight,SETTLED_WIN,2.10,2.04,0.0294,26,28.60,12/13/2025 19:10:53 GMT,12/14/2025 01:02:34 GMT,2025-12-13T19:10:53.812Z,2025-12-14T01:02:34.332Z,Under 6.5 Tre White Total Rebounds Kansas Jayhawks @ N.C. State Wolfpack,,Basketball,NCAAM
8901238129927389470,Hard Rock Sportsbook,straight,SETTLED_LOSS,2.10,1.91,0.1000,10,-10.00,12/12/2025 21:40:21 GMT,12/13/2025 06:00:00 GMT,2025-12-12T21:40:21.177Z,2025-12-13T06:00:00.000Z,Under 2.5 Naz Reid - Threes Made Warriors vs. Timberwolves,,Basketball,NBA
5485539210234167583,Hard Rock Sportsbook,straight,SETTLED_LOSS,2.30,2.74,-0.1606,10,-10.00,12/12/2025 20:16:27 GMT,12/13/2025 06:00:00 GMT,2025-12-12T20:16:27.728Z,2025-12-13T06:00:00.000Z,Under 2.5 Donte DiVincenzo - Threes Made Warriors vs. Timberwolves,,Basketball,NBA
PlacedBet:c/3wwpEOWDIOEyrJTklT2J1oQIw=,theScore Bet,straight,SETTLED_LOSS,2.45,2.62,-0.0649,12,-12.00,12/12/2025 21:40:10 GMT,12/13/2025 05:39:59 GMT,2025-12-12T21:40:10.333Z,2025-12-13T05:39:59.136Z,Under 3.5 Stephen Curry Total 3-Pointers Made Minnesota Timberwolves @ Golden State Warriors,,Basketball,NBA
3020875999748030750,Hard Rock Sportsbook,straight,SETTLED_LOSS,2.00,2.48,-0.1935,10,-10.00,12/12/2025 10:15:38 GMT,12/13/2025 04:23:52 GMT,2025-12-12T10:15:38.298Z,2025-12-13T04:23:52.636Z,Under 1.5 Quinten Post - Threes Made Warriors vs. Timberwolves,,Basketball,NBA
1956007082918150430,Hard Rock Sportsbook,straight,SETTLED_WIN,1.95,1.77,0.1035,10,9.52,12/12/2025 17:35:47 GMT,12/13/2025 04:23:52 GMT,2025-12-12T17:35:47.480Z,2025-12-13T04:23:52.635Z,Under 1.5 Ziaire Williams - Threes Made Mavericks vs. Nets,,Basketball,NBA
5952634160852762912,Hard Rock Sportsbook,straight,SETTLED_LOSS,2.05,1.78,0.1548,10,-10.00,12/12/2025 21:47:46 GMT,12/13/2025 03:44:05 GMT,2025-12-12T21:47:46.274Z,2025-12-13T03:44:05.814Z,Under 30.5 Ja Morant - Points + Assists + Rebounds Grizzlies vs. Jazz,,Basketball,NBA
8517090278794592543,Hard Rock Sportsbook,straight,SETTLED_WIN,2.10,2.00,0.0500,10,11.00,12/12/2025 03:56:13 GMT,12/13/2025 03:00:00 GMT,2025-12-12T03:56:13.841Z,2025-12-13T03:00:00.000Z,Under 2.5 Coby White - Threes Made Hornets vs. Bulls,,Basketball,NBA
6457572233941090591,Hard Rock Sportsbook,straight,SETTLED_WIN,1.91,1.69,0.1299,10,9.09,12/12/2025 03:55:59 GMT,12/13/2025 03:00:00 GMT,2025-12-12T03:55:59.562Z,2025-12-13T03:00:00.000Z,Under 3.5 Brandon Miller - Threes Made Hornets vs. Bulls,,Basketball,NBA
5583174067080134942,Hard Rock Sportsbook,straight,SETTLED_LOSS,2.10,2.62,-0.1985,10,-10.00,12/12/2025 03:54:30 GMT,12/13/2025 03:00:00 GMT,2025-12-12T03:54:30.158Z,2025-12-13T03:00:00.000Z,Under 8.5 VJ Edgecombe - Assists + Rebounds 76ers vs. Pacers,,Basketball,NBA
O/1509382/0000092,Fanduel Sportsbook,straight,SETTLED_WIN,1.96,1.77,0.1087,30,28.85,12/12/2025 22:08:18 GMT,12/13/2025 02:39:31 GMT,2025-12-12T22:08:18.000Z,2025-12-13T02:39:31.000Z,Dyson Daniels Under 5.5 Dyson Daniels - Assists Atlanta Hawks @ Detroit Pistons,,Basketball,NBA
25497990000029420,Fanatics,straight,SETTLED_WIN,2.00,1.87,0.0698,10,10.00,12/12/2025 19:50:45 GMT,12/13/2025 02:38:18 GMT,2025-12-12T19:50:45.797Z,2025-12-13T02:38:18.639Z,Under 12.5 Miles Bridges - Rebounds + Assists OU Chicago Bulls at Charlotte Hornets,,Basketball,NBA
7564772801290961183,Hard Rock Sportsbook,straight,SETTLED_LOSS,1.95,2.12,-0.0791,10,-10.00,12/12/2025 05:10:23 GMT,12/13/2025 02:29:23 GMT,2025-12-12T05:10:23.600Z,2025-12-13T02:29:23.892Z,Under 1.5 Santi Aldama - Threes Made Grizzlies vs. Jazz,,Basketball,NBA
9059982496304464158,Hard Rock Sportsbook,straight,SETTLED_LOSS,1.91,1.74,0.0967,10,-10.00,12/12/2025 17:35:56 GMT,12/13/2025 02:29:23 GMT,2025-12-12T17:35:56.826Z,2025-12-13T02:29:23.888Z,Under 2.5 Klay Thompson - Threes Made Mavericks vs. Nets,,Basketball,NBA
019b10b2-bf67-7858-bc3c-5559373b6745,Novig,straight,SETTLED_WIN,2.15,1.87,0.1503,29.615850000000002,34.07,12/12/2025 03:55:27 GMT,12/13/2025 00:05:00 GMT,2025-12-12T03:55:27.643Z,2025-12-13T00:05:00.000Z,Under 12.5 Miles Bridges REBOUNDS ASSISTS Chicago Bulls @ Charlotte Hornets,,Basketball,NBA
20CAG4S7H2,BetMGM,straight,SETTLED_LOSS,1.83,1.78,0.0292,30,-30.00,12/11/2025 21:56:43 GMT,12/12/2025 05:24:03 GMT,2025-12-11T21:56:43.820Z,2025-12-12T05:24:03.220Z,Under 2.5 Malik Monk (SAC): Rebounds Denver Nuggets at Sacramento Kings,,Basketball,NBA
651191057974559006,Hard Rock Sportsbook,straight,SETTLED_LOSS,2.30,1.92,0.1995,8.7,-8.70,12/11/2025 20:02:51 GMT,12/12/2025 05:23:53 GMT,2025-12-11T20:02:51.613Z,2025-12-12T05:23:53.356Z,Over 7.5 DeMar DeRozan - Assists + Rebounds Kings vs. Nuggets,,Basketball,NBA
2963817959442350366,Hard Rock Sportsbook,straight,SETTLED_WIN,1.91,1.82,0.0491,10,9.09,12/11/2025 21:56:57 GMT,12/12/2025 05:23:53 GMT,2025-12-11T21:56:57.162Z,2025-12-12T05:23:53.355Z,Under 16.5 Russell Westbrook - Assists + Rebounds Kings vs. Nuggets,,Basketball,NBA
13535084425,Bally Bet,straight,SETTLED_LOSS,2.30,2.25,0.0222,2.7,-2.70,12/11/2025 17:17:15 GMT,12/12/2025 05:00:00 GMT,2025-12-11T17:17:15.900Z,2025-12-12T05:00:00.000Z,Alex DeBrincat Under 2.5 Shots on goal by the player - Inc. OT: Alex DeBrincat DET Red Wings at EDM Oilers,,Ice Hockey,NHL
1850201392778314016,Hard Rock Sportsbook,straight,SETTLED_WIN,1.95,1.73,0.1286,10,9.52,12/11/2025 21:08:12 GMT,12/12/2025 04:00:00 GMT,2025-12-11T21:08:12.680Z,2025-12-12T04:00:00.000Z,Under 7.5 Steven Adams - Rebounds Rockets vs. Clippers,,Basketball,NBA
13536650189,Bally Bet,straight,SETTLED_WIN,2.50,2.30,0.0870,2.34,3.51,12/11/2025 20:57:59 GMT,12/12/2025 04:00:00 GMT,2025-12-11T20:57:59.868Z,2025-12-12T04:00:00.000Z,Jake Neighbours Over 1.5 Shots on goal by the player - Inc. OT: Jake Neighbours STL Blues at NSH Predators,,Ice Hockey,NHL
2665440778888413472,Hard Rock Sportsbook,straight,SETTLED_LOSS,2.15,1.94,0.1063,10,-10.00,12/11/2025 17:35:38 GMT,12/12/2025 04:00:00 GMT,2025-12-11T17:35:38.397Z,2025-12-12T04:00:00.000Z,Over 2.5 Kris Dunn - Rebounds Rockets vs. Clippers,,Basketball,NBA
1214456661427355935,Hard Rock Sportsbook,straight,SETTLED_WIN,2.10,2.16,-0.0278,10,11.00,12/11/2025 19:12:50 GMT,12/12/2025 04:00:00 GMT,2025-12-11T19:12:50.980Z,2025-12-12T04:00:00.000Z,Under 7.5 Jerami Grant - Assists + Rebounds Pelicans vs. Trail Blazers,,Basketball,NBA
3909775753243001118,Hard Rock Sportsbook,straight,SETTLED_LOSS,1.91,2.18,-0.1243,10,-10.00,12/11/2025 20:45:34 GMT,12/12/2025 04:00:00 GMT,2025-12-11T20:45:34.187Z,2025-12-12T04:00:00.000Z,Under 4.5 Jerami Grant - Rebounds Pelicans vs. Trail Blazers,,Basketball,NBA
639010306471758335,Draftkings Sportsbook,straight,SETTLED_WIN,1.95,1.78,0.0998,17.71,16.86,12/11/2025 06:17:28 GMT,12/12/2025 03:45:20 GMT,2025-12-11T06:17:28.148Z,2025-12-12T03:45:20.020Z,Under 3.5 Derrick White Three Pointers Made O/U BOS Celtics @ MIL Bucks,,Basketball,NBA
20CABN32B2,BetMGM,straight,SETTLED_LOSS,2.10,2.20,-0.0455,25,-25.00,12/11/2025 19:34:11 GMT,12/12/2025 03:31:07 GMT,2025-12-11T19:34:11.480Z,2025-12-12T03:31:07.537Z,Under 4.5 Kyle Kuzma (MIL): Rebounds Boston Celtics at Milwaukee Bucks,,Basketball,NBA
789141916250538272,Hard Rock Sportsbook,straight,SETTLED_LOSS,2.25,1.71,0.3125,10,-10.00,12/11/2025 05:45:16 GMT,12/12/2025 03:30:54 GMT,2025-12-11T05:45:16.423Z,2025-12-12T03:30:54.718Z,Under 2.5 Jose Alvarado - Rebounds Pelicans vs. Trail Blazers,,Basketball,NBA
9037313384843575582,Hard Rock Sportsbook,straight,SETTLED_WIN,2.05,1.62,0.2676,10,10.50,12/11/2025 05:44:05 GMT,12/12/2025 03:30:54 GMT,2025-12-11T05:44:05.053Z,2025-12-12T03:30:54.680Z,Over 11.5 Derik Queen - Assists + Rebounds Pelicans vs. Trail Blazers,,Basketball,NBA
1348210396057305375,Hard Rock Sportsbook,straight,SETTLED_WIN,2.05,1.87,0.0965,10,10.50,12/11/2025 07:23:37 GMT,12/12/2025 03:30:54 GMT,2025-12-11T07:23:37.905Z,2025-12-12T03:30:54.680Z,Over 11.5 Amen Thompson - Assists + Rebounds Rockets vs. Clippers,,Basketball,NBA
8173340460282806559,Hard Rock Sportsbook,straight,SETTLED_WIN,2.10,1.91,0.1000,10,11.00,12/11/2025 17:26:22 GMT,12/12/2025 03:30:54 GMT,2025-12-11T17:26:22.647Z,2025-12-12T03:30:54.678Z,Under 10.5 Ryan Rollins - Assists + Rebounds Bucks vs. Celtics,,Basketball,NBA
4828425678971732256,Hard Rock Sportsbook,straight,SETTLED_LOSS,1.95,1.85,0.0568,10,-10.00,12/12/2025 00:28:51 GMT,12/12/2025 03:30:54 GMT,2025-12-12T00:28:51.493Z,2025-12-12T03:30:54.662Z,Under 6.5 Bobby Portis - Rebounds Bucks vs. Celtics,,Basketball,NBA
13534995356,Bally Bet,straight,SETTLED_WIN,2.25,2.05,0.0976,2.81,3.51,12/11/2025 17:16:42 GMT,12/12/2025 03:00:00 GMT,2025-12-11T17:16:42.138Z,2025-12-12T03:00:00.000Z,Connor McMichael Under 1.5 Shots on goal by the player - Inc. OT: Connor McMichael CAR Hurricanes at WSH Capitals,,Ice Hockey,NHL
019b0f29-f433-722b-afde-622b08a9bf9e,Novig,straight,SETTLED_LOSS,1.91,2.18,-0.1246,20.00108,-20.00,12/11/2025 20:46:31 GMT,12/12/2025 01:05:00 GMT,2025-12-11T20:46:31.514Z,2025-12-12T01:05:00.000Z,Under 4.5 Jerami Grant REBOUNDS Portland Trail Blazers @ New Orleans Pelicans,,Basketball,NBA
019b0e7b-d116-7cac-80a0-bd28b389ef4c,Novig,straight,SETTLED_WIN,2.30,2.20,0.0449,11.9973,15.58,12/11/2025 17:36:02 GMT,12/12/2025 01:05:00 GMT,2025-12-11T17:36:02.247Z,2025-12-12T01:05:00.000Z,Under 12.5 Ivica Zubac REBOUNDS ASSISTS Los Angeles Clippers @ Houston Rockets,,Basketball,NBA
019b0eb5-b605-7147-b4af-721fa00a00c4,Novig,straight,SETTLED_WIN,2.00,1.83,0.0909,30,30.00,12/11/2025 18:39:14 GMT,12/12/2025 01:05:00 GMT,2025-12-11T18:39:14.577Z,2025-12-12T01:05:00.000Z,Under 2.5 Trey Murphy III THREE POINTERS MADE Portland Trail Blazers @ New Orleans Pelicans,,Basketball,NBA
6803657440383205662,Hard Rock Sportsbook,straight,SETTLED_LOSS,2.20,1.91,0.1524,10,-10.00,12/10/2025 20:48:41 GMT,12/11/2025 06:00:00 GMT,2025-12-10T20:48:41.552Z,2025-12-11T06:00:00.000Z,Under 10.5 Keldon Johnson - Points Lakers vs. Spurs,,Basketball,NBA
7625526867247497503,Hard Rock Sportsbook,straight,SETTLED_WIN,1.95,1.43,0.3608,10,9.52,12/09/2025 23:27:39 GMT,12/11/2025 06:00:00 GMT,2025-12-09T23:27:39.607Z,2025-12-11T06:00:00.000Z,Over 11.5 LeBron James - Assists + Rebounds Lakers vs. Spurs,,Basketball,NBA
13530147122,Bally Bet,straight,SETTLED_WIN,2.10,1.88,0.1187,3.17,3.49,12/10/2025 17:36:36 GMT,12/11/2025 04:30:00 GMT,2025-12-10T17:36:36.597Z,2025-12-11T04:30:00.000Z,Morgan Frost Under 1.5 Shots on goal by the player - Inc. OT: Morgan Frost DET Red Wings at CGY Flames,,Ice Hockey,NHL
639010048673035402,Draftkings Sportsbook,straight,SETTLED_LOSS,1.93,1.87,0.0348,10,-10.00,12/10/2025 23:07:47 GMT,12/11/2025 03:02:34 GMT,2025-12-10T23:07:47.217Z,2025-12-11T03:02:34.169Z,Over 10.5 Mark Williams Points O/U PHO Suns @ OKC Thunder,,Basketball,NBA
2088591869049831710,Hard Rock Sportsbook,straight,SETTLED_LOSS,1.87,1.94,-0.0380,8,-8.00,12/09/2025 21:28:31 GMT,12/11/2025 02:57:44 GMT,2025-12-09T21:28:31.420Z,2025-12-11T02:57:44.301Z,Over 10.5 Jalen Williams - Assists + Rebounds Thunder vs. Suns,,Basketball,NBA
6690470518635364639,Hard Rock Sportsbook,straight,SETTLED_LOSS,1.87,1.94,-0.0380,2,-2.00,12/09/2025 21:31:16 GMT,12/11/2025 02:57:44 GMT,2025-12-09T21:31:16.185Z,2025-12-11T02:57:44.301Z,Over 10.5 Jalen Williams - Assists + Rebounds Thunder vs. Suns,,Basketball,NBA
7904167577188565279,Hard Rock Sportsbook,straight,SETTLED_WIN,2.35,2.12,0.1085,8,10.80,12/10/2025 23:18:32 GMT,12/11/2025 02:57:44 GMT,2025-12-10T23:18:32.342Z,2025-12-11T02:57:44.299Z,Under 7.5 Royce O'Neale - Assists + Rebounds Thunder vs. Suns,,Basketball,NBA
25494947000029920,Fanatics,straight,SETTLED_WIN,2.00,2.09,-0.0431,10,10.00,12/10/2025 17:07:09 GMT,12/11/2025 02:57:19 GMT,2025-12-10T17:07:09.851Z,2025-12-11T02:57:19.177Z,Under 6.5 Grayson Allen - Rebounds + Assists OU Phoenix Suns at Oklahoma City Thunder,,Basketball,NBA
20C8UGZ74R,BetMGM,straight,SETTLED_LOSS,2.00,1.91,0.0476,21,-21.00,12/10/2025 17:52:13 GMT,12/11/2025 02:25:49 GMT,2025-12-10T17:52:13.193Z,2025-12-11T02:25:49.956Z,Under 12.5 Ven-Allen Lubin (NCST): Points Liberty at NC State,,Basketball,NCAAM
25494946000019920,Fanatics,straight,SETTLED_WIN,2.05,1.56,0.3179,10,10.50,12/10/2025 17:06:59 GMT,12/11/2025 02:23:41 GMT,2025-12-10T17:06:59.842Z,2025-12-11T02:23:41.199Z,Over 9.5 Jalen Williams - Rebounds + Assists OU Phoenix Suns at Oklahoma City Thunder,,Basketball,NBA
25494947000019720,Fanatics,straight,SETTLED_LOSS,2.20,2.02,0.0891,10,-10.00,12/10/2025 17:07:20 GMT,12/11/2025 01:36:37 GMT,2025-12-10T17:07:20.656Z,2025-12-11T01:36:37.616Z,Under 1.5 Luguentz Dort - Three Pointers Made OU Phoenix Suns at Oklahoma City Thunder,,Basketball,NBA
019b0a4e-e94b-7c10-b5f3-2dcf3addc4cf,Novig,straight,SETTLED_WIN,1.95,1.91,0.0211,29.99511,28.47,12/10/2025 22:08:30 GMT,12/11/2025 00:35:00 GMT,2025-12-10T22:08:30.690Z,2025-12-11T00:35:00.000Z,Under 2.5 Royce O'Neale THREE POINTERS MADE Phoenix Suns @ Oklahoma City Thunder,,Basketball,NBA
20C7NNL13Z,BetMGM,straight,SETTLED_LOSS,1.95,,,23,-23.00,12/09/2025 22:14:28 GMT,12/10/2025 05:00:00 GMT,2025-12-09T22:14:28.310Z,2025-12-10T05:00:00.000Z,Over 12.5 Boogie Fland (FLO): Points Florida at Connecticut (Neutral  Venue),,Basketball,NCAAM
13525139252,Bally Bet,straight,SETTLED_WIN,1.87,1.74,0.0743,4.01,3.49,12/09/2025 17:28:33 GMT,12/10/2025 05:00:00 GMT,2025-12-09T17:28:33.233Z,2025-12-10T05:00:00.000Z,Evan Bouchard Under 2.5 Shots on goal by the player - Inc. OT: Evan Bouchard BUF Sabres at EDM Oilers,,Ice Hockey,NHL
1354573549,PrizePicks,parlay,SETTLED_LOSS,6.00,6.17,-0.0269,10,-10.00,12/09/2025 23:33:25 GMT,12/10/2025 04:48:00 GMT,2025-12-09T23:33:25.175Z,2025-12-10T04:48:00.000Z,Under 9.5 Brandon Ingram Rebs+Asts TOR vs. NYK | Under 3.5 Grayson Allen Assists PHX vs. OKC | Under 9.5 Deandre Ayton Rebounds LAL vs. SAS,,Basketball,NBA
20C7JPUGRZ,BetMGM,straight,SETTLED_WIN,2.05,2.16,-0.0509,24,25.20,12/09/2025 20:07:13 GMT,12/10/2025 04:35:00 GMT,2025-12-09T20:07:13.340Z,2025-12-10T04:35:00.000Z,Under 13.5 Scottie Barnes (TOR) : Total assists and rebounds New York Knicks at Toronto Raptors,,Basketball,NBA
6466b545-0942-406d-b6ef-3d315536dab6,Onyx,straight,SETTLED_LOSS,2.13,2.05,0.0390,7,-7.00,12/09/2025 23:55:31 GMT,12/10/2025 03:31:17 GMT,2025-12-09T23:55:31.506Z,2025-12-10T03:31:17.093Z,Brandon Ingram Under 1.5 Player Made Threes New York Knicks @ Toronto Raptors,,Basketball,NBA
13526931596,Bally Bet,straight,SETTLED_WIN,2.10,2.00,0.0500,3.17,3.49,12/09/2025 20:58:38 GMT,12/10/2025 03:30:00 GMT,2025-12-09T20:58:38.242Z,2025-12-10T03:30:00.000Z,Sean Monahan Under 1.5 Shots on goal by the player - Inc. OT: Sean Monahan CBJ Blue Jackets at CAR Hurricanes,,Ice Hockey,NHL
13526918751,Bally Bet,straight,SETTLED_WIN,2.10,1.94,0.0806,3.17,3.49,12/09/2025 20:59:15 GMT,12/10/2025 03:00:00 GMT,2025-12-09T20:59:15.052Z,2025-12-10T03:00:00.000Z,Emil Heineman Under 1.5 Shots on goal by the player - Inc. OT: Emil Heineman VGS Golden Knights at NY Islanders,,Ice Hockey,NHL
20C7MYWYBF,BetMGM,straight,SETTLED_WIN,2.26,2.20,0.0273,5,6.30,12/09/2025 21:50:42 GMT,12/10/2025 02:30:00 GMT,2025-12-09T21:50:42.137Z,2025-12-10T02:30:00.000Z,Under 15.5 Yaxel Lendeborg (MICH): Points Villanova at Michigan,,Basketball,NCAAM
7110994932705001759,Hard Rock Sportsbook,straight,SETTLED_LOSS,2.10,1.82,0.1541,10,-10.00,12/09/2025 22:34:42 GMT,12/10/2025 02:00:00 GMT,2025-12-09T22:34:42.474Z,2025-12-10T02:00:00.000Z,Over 12.5 Bam Adebayo - Assists + Rebounds Magic vs. Heat,,Basketball,NBA
4656295542492234015,Hard Rock Sportsbook,straight,SETTLED_WIN,2.05,1.73,0.1850,10,10.50,12/09/2025 17:10:27 GMT,12/10/2025 02:00:00 GMT,2025-12-09T17:10:27.300Z,2025-12-10T02:00:00.000Z,Under 11.5 Paolo Banchero - Assists + Rebounds Magic vs. Heat,,Basketball,NBA
20C7E13D9U,BetMGM,straight,SETTLED_LOSS,2.00,2.17,-0.0783,30,-30.00,12/09/2025 17:37:56 GMT,12/10/2025 00:33:09 GMT,2025-12-09T17:37:56.440Z,2025-12-10T00:33:09.861Z,Under 3.5 Anthony Black (ORL) : Assists Miami Heat at Orlando Magic,,Basketball,NBA
7741502204841558303,Hard Rock Sportsbook,straight,SETTLED_VOID,2.95,,,8,0.00,12/09/2025 21:28:38 GMT,12/10/2025 00:32:55 GMT,2025-12-09T21:28:38.853Z,2025-12-10T00:32:55.652Z,Over 10.5 Immanuel Quickley - Assists + Rebounds Raptors vs. Knicks,,Basketball,NBA
1352227461,PrizePicks,parlay,SETTLED_LOSS,6.00,5.54,0.0822,10,-10.00,12/08/2025 05:28:46 GMT,12/09/2025 06:08:00 GMT,2025-12-08T05:28:46.152Z,2025-12-09T06:08:00.000Z,Over 9.5 De'Aaron Fox Rebs+Asts SAS vs. NOP | Over 0.5 Nick Schmaltz Points UTA vs. LA | Under 1.5 Marcus Johansson Shots On Goal MIN vs. SEA,,Basketball | Ice Hockey,NBA | NHL
1352228215,PrizePicks,parlay,SETTLED_LOSS,6.00,5.54,0.0822,10,-10.00,12/08/2025 05:30:00 GMT,12/09/2025 06:08:00 GMT,2025-12-08T05:30:00.376Z,2025-12-09T06:08:00.000Z,Over 9.5 De'Aaron Fox Rebs+Asts SAS vs. NOP | Over 0.5 Nick Schmaltz Points UTA vs. LA | Under 1.5 Marcus Johansson Shots On Goal MIN vs. SEA,,Basketball | Ice Hockey,NBA | NHL
13520535840,Bally Bet,straight,SETTLED_WIN,2.20,2.10,0.0476,2.91,3.49,12/08/2025 16:18:12 GMT,12/09/2025 05:00:00 GMT,2025-12-08T16:18:12.036Z,2025-12-09T05:00:00.000Z,Quinton Byfield Under 1.5 Shots on goal by the player - Inc. OT: Quinton Byfield LA Kings at UTA Mammoth,,Ice Hockey,NHL
bce94d9b-a5d6-4094-9413-19d6e887d9df,Dabble,parlay,SETTLED_LOSS,6.00,,,10,-10.00,12/04/2025 23:10:27 GMT,12/09/2025 04:50:06 GMT,2025-12-04T23:10:27.997Z,2025-12-09T04:50:06.522Z,Under 10.5 Brice Sensabaugh points Utah Jazz @ Brooklyn Nets | Under 8.5 Kyle Filipowski rebounds Utah Jazz @ Brooklyn Nets | Over 46.5 Ladd McConkey receiving-yards Philadelphia Eagles @ Los Angeles Chargers,,Basketball | American Football,NBA | NFL
1352226839,PrizePicks,parlay,SETTLED_LOSS,6.00,5.56,0.0791,10,-10.00,12/08/2025 05:27:43 GMT,12/09/2025 04:10:00 GMT,2025-12-08T05:27:43.606Z,2025-12-09T04:10:00.000Z,Over 1.5 Harrison Barnes Assists SAS vs. NOP | Over 0.5 Nick Schmaltz Points UTA vs. LA | Under 1.5 Marcus Johansson Shots On Goal MIN vs. SEA,,Basketball | Ice Hockey,NBA | NHL
1352226166,PrizePicks,parlay,SETTLED_LOSS,6.00,,,10,-10.00,12/08/2025 05:26:36 GMT,12/09/2025 04:10:00 GMT,2025-12-08T05:26:36.934Z,2025-12-09T04:10:00.000Z,Over 9.5 De'Aaron Fox Rebs+Asts SAS vs. NOP | Over 0.5 Nick Schmaltz Points UTA vs. LA | Over 1.5 Harrison Barnes Assists SAS vs. NOP,,Basketball | Ice Hockey,NBA | NHL
1920140498089804064,Hard Rock Sportsbook,straight,SETTLED_WIN,1.91,1.95,-0.0222,10,9.09,12/08/2025 18:33:30 GMT,12/09/2025 04:00:00 GMT,2025-12-08T18:33:30.564Z,2025-12-09T04:00:00.000Z,Under 8.5 Saddiq Bey - Assists + Rebounds Pelicans vs. Spurs,,Basketball,NBA
13520898636,Bally Bet,straight,SETTLED_LOSS,2.15,2.04,0.0539,3.04,-3.04,12/08/2025 17:34:27 GMT,12/09/2025 03:30:00 GMT,2025-12-08T17:34:27.227Z,2025-12-09T03:30:00.000Z,Anthony Cirelli Under 1.5 Shots on goal by the player - Inc. OT: Anthony Cirelli TB Lightning at TOR Maple Leafs,,Ice Hockey,NHL
13520822269,Bally Bet,straight,SETTLED_WIN,2.15,1.87,0.1500,3.04,3.50,12/08/2025 17:31:42 GMT,12/09/2025 03:30:00 GMT,2025-12-08T17:31:42.181Z,2025-12-09T03:30:00.000Z,Oliver Björkstrand Under 1.5 Shots on goal by the player - Inc. OT: Oliver Björkstrand TB Lightning at TOR Maple Leafs,,Ice Hockey,NHL
13520919110,Bally Bet,straight,SETTLED_WIN,2.25,2.15,0.0465,2.79,3.49,12/08/2025 17:47:31 GMT,12/09/2025 03:30:00 GMT,2025-12-08T17:47:31.500Z,2025-12-09T03:30:00.000Z,Victor Hedman Under 1.5 Shots on goal by the player - Inc. OT: Victor Hedman TB Lightning at TOR Maple Leafs,,Ice Hockey,NHL
4686509553745658144,Hard Rock Sportsbook,straight,SETTLED_LOSS,2.10,1.91,0.1000,8,-8.00,12/08/2025 16:19:27 GMT,12/09/2025 03:29:45 GMT,2025-12-08T16:19:27.089Z,2025-12-09T03:29:45.300Z,Under 9.5 Anthony Edwards - Assists + Rebounds Timberwolves vs. Suns,,Basketball,NBA
1397727613433938208,Hard Rock Sportsbook,straight,SETTLED_LOSS,2.10,1.91,0.1000,2,-2.00,12/08/2025 16:21:59 GMT,12/09/2025 03:29:45 GMT,2025-12-08T16:21:59.806Z,2025-12-09T03:29:45.298Z,Under 9.5 Anthony Edwards - Assists + Rebounds Timberwolves vs. Suns,,Basketball,NBA
20C4Z3GC0R,BetMGM,straight,SETTLED_WIN,1.91,1.71,0.1136,30,27.27,12/07/2025 23:31:17 GMT,12/08/2025 03:38:21 GMT,2025-12-07T23:31:17.493Z,2025-12-08T03:38:21.917Z,Over 1.5 Svi Mykhailiuk (UTA): Three-pointers made Oklahoma City Thunder at Utah Jazz,,Basketball,NBA
1346856014,PrizePicks,parlay,SETTLED_WIN,6.00,,,5,25.00,12/05/2025 19:33:48 GMT,12/08/2025 00:27:00 GMT,2025-12-05T19:33:48.209Z,2025-12-08T00:27:00.000Z,Under 3.5 James Harden 3-PT Made LAC vs. MEM | Under 23.5 Ajay Mitchell Pts+Rebs+Asts OKC vs. DAL | Under 19.5 Jordan Love Pass Completions GB vs. CHI,,Basketball | American Football,NBA | NFL
1346917139,PrizePicks,parlay,SETTLED_WIN,6.00,4.98,0.2057,10,50.00,12/05/2025 20:10:38 GMT,12/08/2025 00:27:00 GMT,2025-12-05T20:10:38.140Z,2025-12-08T00:27:00.000Z,Under 3.5 VJ Edgecombe Assists PHI vs. MIL | Under 20.5 Tua Tagovailoa Pass Completions MIA vs. NYJ | Under 19.5 Jordan Love Pass Completions GB vs. CHI,,Basketball | American Football,NBA | NFL
1346350499,PrizePicks,parlay,SETTLED_WIN,6.00,,,10,50.00,12/05/2025 07:06:21 GMT,12/08/2025 00:27:00 GMT,2025-12-05T07:06:21.168Z,2025-12-08T00:27:00.000Z,Under 6.5 Toumani Camara Rebounds POR vs. DET | Under 12.5 AJ Green Points MIL vs. PHI | Under 19.5 Jordan Love Pass Completions GB vs. CHI,,Basketball | American Football,NBA | NFL
616428d0-bccb-4083-99c0-42f222404b70,Dabble,parlay,SETTLED_LOSS,6.00,,,10,-10.00,12/05/2025 16:00:00 GMT,12/07/2025 21:26:48 GMT,2025-12-05T16:00:00.526Z,2025-12-07T21:26:48.434Z,Under 20.5 Aaron Rodgers passing-completions Pittsburgh Steelers @ Baltimore Ravens | Under 20.5 Baker Mayfield passing-completions New Orleans Saints @ Tampa Bay Buccaneers | Over 2.5 Tyjae Spears receptions Tennessee Titans @ Cleveland Browns,,American Football,NFL
ad571a38-6282-4c9a-a039-11d72bb13699,Dabble,parlay,SETTLED_LOSS,6.00,,,10,-10.00,12/04/2025 19:05:41 GMT,12/07/2025 21:18:30 GMT,2025-12-04T19:05:41.832Z,2025-12-07T21:18:30.819Z,Over 49.5 Chase Brown rushing-yards Cincinnati Bengals @ Buffalo Bills | Under 20.5 Aaron Rodgers passing-completions Pittsburgh Steelers @ Baltimore Ravens | Under 20.5 Baker Mayfield passing-completions New Orleans Saints @ Tampa Bay Buccaneers,,American Football,NFL
bd27e613-9e96-42aa-879d-5606b197139d,Dabble,parlay,SETTLED_LOSS,3.00,,,5,-5.00,12/05/2025 19:42:19 GMT,12/07/2025 21:17:43 GMT,2025-12-05T19:42:19.496Z,2025-12-07T21:17:43.602Z,Under 11.5 Anthony Davis rebounds Dallas Mavericks @ Oklahoma City Thunder | Under 0.5 Chase Brown anytime-touchdown Cincinnati Bengals @ Buffalo Bills,,Basketball | American Football,NBA | NFL
26942eb9-e887-40b1-9609-1a48175ec74f,Dabble,parlay,SETTLED_LOSS,6.00,,,10,-10.00,12/05/2025 19:40:48 GMT,12/07/2025 21:17:40 GMT,2025-12-05T19:40:48.814Z,2025-12-07T21:17:40.357Z,Under 11.5 Anthony Davis rebounds Dallas Mavericks @ Oklahoma City Thunder | Under 0.5 Travis Etienne Jr. anytime-touchdown Indianapolis Colts @ Jacksonville Jaguars | Under 0.5 Chase Brown anytime-touchdown Cincinnati Bengals @ Buffalo Bills,,Basketball | American Football,NBA | NFL
1292c9c9-dc99-4022-9a6a-4963f31cc04c,Dabble,parlay,SETTLED_LOSS,3.00,,,5,-5.00,12/05/2025 19:41:46 GMT,12/07/2025 21:17:39 GMT,2025-12-05T19:41:46.243Z,2025-12-07T21:17:39.931Z,Under 0.5 Travis Etienne Jr. anytime-touchdown Indianapolis Colts @ Jacksonville Jaguars | Under 11.5 Anthony Davis rebounds Dallas Mavericks @ Oklahoma City Thunder,,American Football | Basketball,NFL | NBA
ef366d58-9e50-4e82-bafc-c737ad69320b,Dabble,parlay,SETTLED_WIN,6.00,,,10,50.00,12/03/2025 19:47:34 GMT,12/07/2025 21:10:29 GMT,2025-12-03T19:47:34.261Z,2025-12-07T21:10:29.361Z,Under 20.5 Baker Mayfield passing-completions New Orleans Saints @ Tampa Bay Buccaneers | Under 5.5 Naji Marshall rebounds Miami Heat @ Dallas Mavericks | Under 4.5 Jarace Walker rebounds Denver Nuggets @ Indiana Pacers,,American Football | Basketball,NFL | NBA
20C0LA0KDS,BetMGM,straight,SETTLED_WIN,2.00,1.83,0.0909,8,8.00,12/04/2025 21:30:48 GMT,12/07/2025 21:00:00 GMT,2025-12-04T21:30:48.143Z,2025-12-07T21:00:00.000Z,Under 4.5 Khalil Shakir (BUF): Receptions made Cincinnati Bengals at Buffalo Bills,,American Football,NFL
20BXSARDW2,BetMGM,straight,SETTLED_WIN,1.91,,,8,7.27,12/02/2025 20:58:53 GMT,12/07/2025 21:00:00 GMT,2025-12-02T20:58:53.503Z,2025-12-07T21:00:00.000Z,Over 31.5 Zach Charbonnet (SEA): Rushing yards Seattle Seahawks at Atlanta Falcons,,American Football,NFL
53a2e327-a954-4fc3-b05e-125f12e5761e,Dabble,parlay,SETTLED_WIN,6.00,,,10,50.00,12/05/2025 17:22:57 GMT,12/07/2025 20:44:19 GMT,2025-12-05T17:22:57.902Z,2025-12-07T20:44:19.955Z,Under 3.5 T.J. Hockenson receptions Washington Commanders @ Minnesota Vikings | Under 2.5 Ryan Rollins three-made Philadelphia 76ers @ Milwaukee Bucks | Under 3.5 James Harden three-made Los Angeles Clippers @ Memphis Grizzlies,,American Football | Basketball,NFL | NBA
019aecc3-e3f2-7157-90db-b4322d462281,Novig,straight,SETTLED_LOSS,2.09,1.91,0.0958,7.99694,-8.00,12/05/2025 04:29:13 GMT,12/07/2025 18:00:00 GMT,2025-12-05T04:29:13.718Z,2025-12-07T18:00:00.000Z,Under 12.5 Rachaad White RUSHING YARDS New Orleans Saints @ Tampa Bay Buccaneers,,American Football,NFL
019aeab5-5239-7890-a6df-7aebdaab0544,Novig,straight,SETTLED_LOSS,2.16,,,7.99601,-8.00,12/04/2025 18:52:26 GMT,12/07/2025 18:00:00 GMT,2025-12-04T18:52:26.321Z,2025-12-07T18:00:00.000Z,Under 55.5 Zay Flowers RECEIVING YARDS Pittsburgh Steelers @ Baltimore Ravens,,American Football,NFL
20C3D72AT0,BetMGM,straight,SETTLED_WIN,1.87,1.50,0.2464,17,14.78,12/06/2025 20:55:24 GMT,12/07/2025 04:40:00 GMT,2025-12-06T20:55:24.510Z,2025-12-07T04:40:00.000Z,Under 8.5 D’Angelo Russell (DAL): Points Houston Rockets at Dallas Mavericks,,Basketball,NBA
20C390GKF3,BetMGM,straight,SETTLED_WIN,2.05,1.88,0.0876,75,78.75,12/06/2025 18:40:59 GMT,12/07/2025 03:47:50 GMT,2025-12-06T18:40:59.847Z,2025-12-07T03:47:50.703Z,Under 10.5 Kel’el Ware (MIA): Rebounds Sacramento Kings at Miami Heat,,Basketball,NBA
20C3M3P93B,BetMGM,straight,SETTLED_LOSS,9.00,,,50,-50.00,12/07/2025 01:07:53 GMT,12/07/2025 03:21:59 GMT,2025-12-07T01:07:53.790Z,2025-12-07T03:21:59.290Z,Yes Dean Wade to score 10+ points Golden State Warriors @ Cleveland Cavaliers,,Basketball,NBA
639005971926963069,Draftkings Sportsbook,straight,SETTLED_LOSS,2.08,2.22,-0.0631,7.8,-7.80,12/06/2025 05:53:13 GMT,12/07/2025 03:19:14 GMT,2025-12-06T05:53:13.828Z,2025-12-07T03:19:14.238Z,Under 8.5 Darius Garland Rebounds + Assists O/U GS Warriors @ CLE Cavaliers,,Basketball,NBA
O/1509382/0000091,Fanduel Sportsbook,straight,SETTLED_WIN,1.98,1.87,0.0593,8,7.84,12/06/2025 05:54:01 GMT,12/07/2025 03:12:16 GMT,2025-12-06T05:54:01.000Z,2025-12-07T03:12:16.000Z,Brandin Podziemski Under 8.5 Brandin Podziemski - Reb + Ast Golden State Warriors @ Cleveland Cavaliers,,Basketball,NBA
20C394PYZX,BetMGM,straight,SETTLED_LOSS,2.05,2.10,-0.0238,150,-150.00,12/06/2025 18:44:47 GMT,12/07/2025 03:02:39 GMT,2025-12-06T18:44:47.923Z,2025-12-07T03:02:39.287Z,Under 8.5 Cade Cunningham (DET): Assists Milwaukee Bucks at Detroit Pistons,,Basketball,NBA
452849001570238750,Hard Rock Sportsbook,straight,SETTLED_WIN,2.25,2.25,,4,5.00,12/07/2025 00:17:41 GMT,12/07/2025 03:02:22 GMT,2025-12-07T00:17:41.125Z,2025-12-07T03:02:22.656Z,Over 7.5 Bobby Portis - Assists + Rebounds Pistons vs. Bucks,,Basketball,NBA
7184c542-00e7-4325-9679-ff5526471f7e,Onyx,straight,SETTLED_LOSS,2.08,2.22,-0.0631,8,-8.00,12/06/2025 05:53:28 GMT,12/07/2025 03:00:46 GMT,2025-12-06T05:53:28.040Z,2025-12-07T03:00:46.190Z,Darius Garland Under 8.5 Player Rebounds + Assists Golden State Warriors @ Cleveland Cavaliers,,Basketball,NBA
019af572-34f8-7e15-af59-6d18e7c3b1c6,Novig,straight,SETTLED_LOSS,2.35,2.30,0.0206,12.99726,-13.00,12/06/2025 20:55:04 GMT,12/07/2025 01:35:00 GMT,2025-12-06T20:55:04.084Z,2025-12-07T01:35:00.000Z,Over 8.5 D'Angelo Russell POINTS Houston Rockets @ Dallas Mavericks,,Basketball,NBA
1e147930-d309-11f0-8747-eb45e57b2509,Caesars Sportsbook,straight,SETTLED_CASH_OUT,2.03,,,150,-0.75,12/07/2025 01:07:36 GMT,12/07/2025 01:12:33 GMT,2025-12-07T01:07:36.131Z,2025-12-07T01:12:33.626Z,Under 9.5 Quinten Post - Total Points Live Golden State Warriors at Cleveland Cavaliers,,Basketball,NBA
019af4f6-f80a-7519-87ea-ba9fea6c9df1,Novig,straight,SETTLED_LOSS,2.03,2.05,-0.0105,74.99516,-75.00,12/06/2025 18:41:09 GMT,12/07/2025 01:05:00 GMT,2025-12-06T18:41:09.591Z,2025-12-07T01:05:00.000Z,Over 10.5 Kel'el Ware REBOUNDS Sacramento Kings @ Miami Heat,,Basketball,NBA
019af4fa-5b8f-7dc5-a62d-fd43b38d03e2,Novig,straight,SETTLED_WIN,2.01,1.82,0.1035,149.9976,151.20,12/06/2025 18:44:27 GMT,12/07/2025 00:35:00 GMT,2025-12-06T18:44:27.078Z,2025-12-07T00:35:00.000Z,Over 8.5 Cade Cunningham ASSISTS Milwaukee Bucks @ Detroit Pistons,,Basketball,NBA
639005970337380882,Draftkings Sportsbook,straight,SETTLED_LOSS,2.04,1.88,0.0867,6.48,-6.48,12/06/2025 05:50:34 GMT,12/07/2025 00:26:26 GMT,2025-12-06T05:50:34.119Z,2025-12-07T00:26:26.546Z,Under 7.5 Egor Demin Rebounds + Assists O/U NO Pelicans @ BKN Nets,,Basketball,NBA
20C24R8AKG,BetMGM,straight,SETTLED_LOSS,1.87,,,8,-8.00,12/05/2025 23:20:08 GMT,12/07/2025 00:00:00 GMT,2025-12-05T23:20:08.240Z,2025-12-07T00:00:00.000Z,Over 31.5 Isaiah Horton (ALA): Receiving yards Georgia at Alabama (Neutral Venue),,American Football,NCAAFB
7260119641953665310,Hard Rock Sportsbook,straight,SETTLED_WIN,1.87,,,2.44,2.12,12/05/2025 21:13:13 GMT,12/06/2025 20:00:00 GMT,2025-12-05T21:13:13.834Z,2025-12-06T20:00:00.000Z,Under 87.5 Broc Lowry - Rushing Yards Western Michigan vs. Miami (OH),,American Football,NCAAFB
13504668087,Bally Bet,straight,SETTLED_LOSS,2.50,2.50,,2.32,-2.32,12/05/2025 19:29:20 GMT,12/06/2025 06:00:00 GMT,2025-12-05T19:29:20.330Z,2025-12-06T06:00:00.000Z,Leo Carlsson Under 1.5 Shots on goal by the player - Inc. OT: Leo Carlsson WSH Capitals at ANA Ducks,,Ice Hockey,NHL
69335b4829c47d5905dbe240,Betr Picks,parlay,SETTLED_WIN,6.00,6.05,-0.0089,7,35.00,12/05/2025 22:23:04 GMT,12/06/2025 05:17:31 GMT,2025-12-05T22:23:04.759Z,2025-12-06T05:17:31.528Z,Under 6.5 Jabari Smith Jr. Rebounds PHO vs. HOU | Under 25.5 Lauri Markkanen Points UTA vs. NY | Under 19.5 Jalen Williams Points DAL vs. OKC,,Basketball,NBA
639005369958059595,Draftkings Sportsbook,straight,SETTLED_WIN,1.93,1.74,0.1064,7.28,6.74,12/05/2025 13:09:54 GMT,12/06/2025 05:12:11 GMT,2025-12-05T13:09:54.747Z,2025-12-06T05:12:11.940Z,Under 7.5 Ajay Mitchell Rebounds + Assists O/U DAL Mavericks @ OKC Thunder,,Basketball,NBA
639005533636531693,Draftkings Sportsbook,straight,SETTLED_WIN,1.90,1.74,0.0920,3.74,3.36,12/05/2025 17:42:43 GMT,12/06/2025 05:12:11 GMT,2025-12-05T17:42:43.410Z,2025-12-06T05:12:11.717Z,Under 7.5 Ajay Mitchell Rebounds + Assists O/U DAL Mavericks @ OKC Thunder,,Basketball,NBA
4aa027dc-5330-4c53-99ff-da5e0ecf04f4,Onyx,parlay,SETTLED_LOSS,11.24,7.13,0.5760,5,-5.00,12/06/2025 01:43:59 GMT,12/06/2025 05:07:36 GMT,2025-12-06T01:43:59.582Z,2025-12-06T05:07:36.457Z,Pat Bryant Under 2.5 Player Receptions Denver Broncos @ Las Vegas Raiders | DJ Moore Over 39.5 Player Receiving Yards Chicago Bears @ Green Bay Packers | Shai Gilgeous-Alexander Under 43.5 Player Points + Rebounds + Assists Dallas Mavericks @ Oklahoma City Thunder,,American Football | Basketball,NFL | NBA
O/1509382/0000086,Fanduel Sportsbook,straight,SETTLED_WIN,1.94,1.93,0.0046,4,3.77,12/05/2025 19:39:40 GMT,12/06/2025 05:02:32 GMT,2025-12-05T19:39:40.000Z,2025-12-06T05:02:32.000Z,Cason Wallace Under 5.5 Cason Wallace - Reb + Ast Dallas Mavericks @ Oklahoma City Thunder,,Basketball,NBA
13504668147,Bally Bet,straight,SETTLED_LOSS,1.70,1.63,0.0436,4.99,-4.99,12/05/2025 19:29:49 GMT,12/06/2025 05:00:00 GMT,2025-12-05T19:29:49.790Z,2025-12-06T05:00:00.000Z,Conor Garland Under 2.5 Shots on goal by the player - Inc. OT: Conor Garland UTA Mammoth at VAN Canucks,,Ice Hockey,NHL
13502899283,Bally Bet,straight,SETTLED_LOSS,2.25,2.25,,2.79,-2.79,12/05/2025 12:46:22 GMT,12/06/2025 05:00:00 GMT,2025-12-05T12:46:22.407Z,2025-12-06T05:00:00.000Z,Logan Cooley Under 1.5 Shots on goal by the player - Inc. OT: Logan Cooley UTA Mammoth at VAN Canucks,,Ice Hockey,NHL
20C20ZEA6G,BetMGM,straight,SETTLED_WIN,2.10,2.00,0.0500,5,5.51,12/05/2025 21:19:29 GMT,12/06/2025 04:00:00 GMT,2025-12-05T21:19:29.353Z,2025-12-06T04:00:00.000Z,Under 103.5 Wyatt Young (NTX): Receiving yards North Texas at Tulane,,American Football,NCAAFB
13502903202,Bally Bet,straight,SETTLED_WIN,2.10,2.10,,3.18,3.50,12/05/2025 12:42:27 GMT,12/06/2025 04:00:00 GMT,2025-12-05T12:42:27.053Z,2025-12-06T04:00:00.000Z,Jason Robertson Under 3.5 Shots on goal by the player - Inc. OT: Jason Robertson SJ Sharks at DAL Stars,,Ice Hockey,NHL
20C0CP47N5,BetMGM,straight,SETTLED_LOSS,1.87,,,8,-8.00,12/04/2025 17:27:34 GMT,12/06/2025 04:00:00 GMT,2025-12-04T17:27:34.940Z,2025-12-06T04:00:00.000Z,Under 36.5 Chase Penry (BOI): Receiving yards UNLV at Boise State,,American Football,NCAAFB
1346614332,PrizePicks,parlay,SETTLED_WIN,3.00,,,5,10.00,12/05/2025 16:47:58 GMT,12/06/2025 03:50:11 GMT,2025-12-05T16:47:58.886Z,2025-12-06T03:50:11.743Z,Under 6.5 Jeremy Sochan Rebounds SAS vs. CLE | Under 3.5 James Harden 3-PT Made LAC vs. MEM,,Basketball,NBA
2822076209787830560,Hard Rock Sportsbook,straight,SETTLED_WIN,1.83,,,8,6.67,12/05/2025 07:04:23 GMT,12/06/2025 03:50:11 GMT,2025-12-05T07:04:23.343Z,2025-12-06T03:50:11.478Z,Under 20.5 Josh Giddey - Assists + Rebounds Bulls vs. Pacers,,Basketball,NBA
6542272533205090591,Hard Rock Sportsbook,straight,SETTLED_WIN,1.87,1.80,0.0386,8,6.96,12/05/2025 12:41:54 GMT,12/06/2025 03:50:11 GMT,2025-12-05T12:41:54.730Z,2025-12-06T03:50:11.477Z,Under 8.5 T.J. McConnell - Assists + Rebounds Bulls vs. Pacers,,Basketball,NBA
7976260672654410014,Hard Rock Sportsbook,straight,SETTLED_WIN,2.00,1.77,0.1304,8,8.00,12/05/2025 07:27:35 GMT,12/06/2025 03:50:11 GMT,2025-12-05T07:27:35.844Z,2025-12-06T03:50:11.476Z,Under 13.5 Nikola Vucevic - Assists + Rebounds Bulls vs. Pacers,,Basketball,NBA
138050788164108575,Hard Rock Sportsbook,straight,SETTLED_WIN,2.00,1.77,0.1304,8,8.00,12/05/2025 15:43:30 GMT,12/06/2025 03:50:11 GMT,2025-12-05T15:43:30.427Z,2025-12-06T03:50:11.475Z,Under 8.5 VJ Edgecombe - Assists + Rebounds Bucks vs. 76ers,,Basketball,NBA
693334d1b5a6d86456175104,Betr Picks,parlay,SETTLED_LOSS,6.00,,,10,-10.00,12/05/2025 19:38:57 GMT,12/06/2025 03:49:17 GMT,2025-12-05T19:38:57.342Z,2025-12-06T03:49:17.129Z,Under 18.5 Amen Thompson Points PHO vs. HOU | Under 8.5 Mark Williams Rebounds PHO vs. HOU | Under 7.5 Shaedon Sharpe AST+REB POR vs. DET,,Basketball,NBA
ace9343a-fb36-4c74-be1f-aa01600ea3cf,Onyx,straight,SETTLED_WIN,1.90,1.87,0.0168,8,7.21,12/05/2025 13:09:35 GMT,12/06/2025 03:43:25 GMT,2025-12-05T13:09:35.427Z,2025-12-06T03:43:25.417Z,Josh Giddey Under 19.5 Player Rebounds + Assists Indiana Pacers @ Chicago Bulls,,Basketball,NBA
3ef8434e-0b4e-4032-88fd-7f41d328aa69,Onyx,straight,SETTLED_LOSS,2.06,,,8,-8.00,12/05/2025 17:42:29 GMT,12/06/2025 03:43:24 GMT,2025-12-05T17:42:29.246Z,2025-12-06T03:43:24.180Z,Craig Porter Jr. Under 6.5 Player Rebounds + Assists San Antonio Spurs @ Cleveland Cavaliers,,Basketball,NBA
639005664399569428,Draftkings Sportsbook,straight,SETTLED_LOSS,2.09,,,8,-8.00,12/05/2025 21:20:39 GMT,12/06/2025 03:41:17 GMT,2025-12-05T21:20:39.321Z,2025-12-06T03:41:17.998Z,Under 7.5 Coby White Rebounds + Assists O/U IND Pacers @ CHI Bulls,,Basketball,NBA
639005152292734563,Draftkings Sportsbook,straight,SETTLED_WIN,1.81,,,8,6.50,12/05/2025 07:07:09 GMT,12/06/2025 03:40:56 GMT,2025-12-05T07:07:09.531Z,2025-12-06T03:40:56.012Z,Under 20.5 Josh Giddey Rebounds + Assists O/U IND Pacers @ CHI Bulls,,Basketball,NBA
20C212H7Y6,BetMGM,straight,SETTLED_WIN,1.95,1.95,,8,7.62,12/05/2025 21:22:08 GMT,12/06/2025 03:37:26 GMT,2025-12-05T21:22:08.107Z,2025-12-06T03:37:26.368Z,Under 18.5 Markus Burton (ND) : Points Notre Dame at TCU,,Basketball,NCAAM
20C20ZES87,BetMGM,straight,SETTLED_LOSS,2.00,2.00,,8,-8.00,12/05/2025 21:19:50 GMT,12/06/2025 03:37:26 GMT,2025-12-05T21:19:50.833Z,2025-12-06T03:37:26.368Z,Under 12.5 Jalen Haralson (ND): Points Notre Dame at TCU,,Basketball,NCAAM
45c50700-d1ed-11f0-80f7-2b6c159d088b,Caesars Sportsbook,straight,SETTLED_WIN,1.93,1.87,0.0348,8,7.48,12/05/2025 15:15:45 GMT,12/06/2025 03:34:23 GMT,2025-12-05T15:15:45.648Z,2025-12-06T03:34:23.104Z,Under 19.5 Josh Giddey - Total Rebounds + Assists Indiana Pacers at Chicago Bulls,,Basketball,NBA
7703017326647181598,Hard Rock Sportsbook,straight,SETTLED_VOID,1.87,,,8,0.00,12/05/2025 19:27:57 GMT,12/06/2025 03:33:02 GMT,2025-12-05T19:27:57.761Z,2025-12-06T03:33:02.807Z,Under 15.5 Alperen Sengun - Assists + Rebounds Rockets vs. Suns,,Basketball,NBA
25487505000019820,Fanatics,straight,SETTLED_WIN,1.91,1.87,0.0211,8,7.27,12/05/2025 13:05:46 GMT,12/06/2025 03:31:14 GMT,2025-12-05T13:05:46.546Z,2025-12-06T03:31:14.287Z,Under 19.5 Josh Giddey - Rebounds + Assists OU Indiana Pacers at Chicago Bulls,,Basketball,NBA
O/1509382/0000088,Fanduel Sportsbook,straight,SETTLED_WIN,1.90,1.82,0.0446,8,7.21,12/05/2025 23:33:59 GMT,12/06/2025 03:31:01 GMT,2025-12-05T23:33:59.000Z,2025-12-06T03:31:01.000Z,Toumani Camara Under 8.5 Toumani Camara - Reb + Ast Portland Trail Blazers @ Detroit Pistons,,Basketball,NBA
639005731727448981,Draftkings Sportsbook,straight,SETTLED_LOSS,1.77,1.69,0.0471,8,-8.00,12/05/2025 23:12:52 GMT,12/06/2025 03:30:00 GMT,2025-12-05T23:12:52.753Z,2025-12-06T03:30:00.000Z,Under 2.5 Jerami Grant Three Pointers Made O/U POR Trail Blazers @ DET Pistons,,Basketball,NBA
7403419022466482462,Hard Rock Sportsbook,straight,SETTLED_LOSS,1.83,1.93,-0.0481,8,-8.00,12/05/2025 17:46:47 GMT,12/06/2025 03:30:00 GMT,2025-12-05T17:46:47.524Z,2025-12-06T03:30:00.000Z,Under 7.5 Shaedon Sharpe - Assists + Rebounds Pistons vs. Trail Blazers,,Basketball,NBA
9053997159300202784,Hard Rock Sportsbook,straight,SETTLED_VOID,1.74,,,2,0.00,12/05/2025 19:27:18 GMT,12/06/2025 03:30:00 GMT,2025-12-05T19:27:18.766Z,2025-12-06T03:30:00.000Z,Under 12.5 Donovan Clingan - Assists + Rebounds Pistons vs. Trail Blazers,,Basketball,NBA
7705800877771850015,Hard Rock Sportsbook,straight,SETTLED_VOID,1.74,,,8,0.00,12/05/2025 19:19:15 GMT,12/06/2025 03:30:00 GMT,2025-12-05T19:19:15.989Z,2025-12-06T03:30:00.000Z,Under 12.5 Donovan Clingan - Assists + Rebounds Pistons vs. Trail Blazers,,Basketball,NBA
1175577595563737374,Hard Rock Sportsbook,straight,SETTLED_LOSS,1.83,1.93,-0.0481,2,-2.00,12/05/2025 18:13:53 GMT,12/06/2025 03:30:00 GMT,2025-12-05T18:13:53.539Z,2025-12-06T03:30:00.000Z,Under 7.5 Shaedon Sharpe - Assists + Rebounds Pistons vs. Trail Blazers,,Basketball,NBA
6286180881933271327,Hard Rock Sportsbook,straight,SETTLED_WIN,1.95,1.82,0.0729,8,7.62,12/05/2025 12:41:30 GMT,12/06/2025 03:30:00 GMT,2025-12-05T12:41:30.287Z,2025-12-06T03:30:00.000Z,Under 8.5 Toumani Camara - Assists + Rebounds Pistons vs. Trail Blazers,,Basketball,NBA
273304902510051616,Hard Rock Sportsbook,straight,SETTLED_LOSS,2.00,1.93,0.0385,8,-8.00,12/05/2025 07:04:01 GMT,12/06/2025 03:30:00 GMT,2025-12-05T07:04:01.822Z,2025-12-06T03:30:00.000Z,Under 15.5 Deni Avdija - Assists + Rebounds Pistons vs. Trail Blazers,,Basketball,NBA
O/1509382/0000085,Fanduel Sportsbook,straight,SETTLED_WIN,1.88,2.05,-0.0843,8,7.02,12/05/2025 19:37:03 GMT,12/06/2025 03:29:42 GMT,2025-12-05T19:37:03.000Z,2025-12-06T03:29:42.000Z,Amen Thompson Under 13.5 Amen Thompson - Reb + Ast Phoenix Suns @ Houston Rockets,,Basketball,NBA
O/1509382/0000089,Fanduel Sportsbook,straight,SETTLED_WIN,1.88,1.83,0.0282,8,7.08,12/05/2025 23:34:13 GMT,12/06/2025 03:29:32 GMT,2025-12-05T23:34:13.000Z,2025-12-06T03:29:32.000Z,Grayson Allen Under 6.5 Grayson Allen - Reb + Ast Phoenix Suns @ Houston Rockets,,Basketball,NBA
O/1509382/0000090,Fanduel Sportsbook,straight,SETTLED_WIN,2.04,2.00,0.0200,8,8.32,12/05/2025 23:48:43 GMT,12/06/2025 03:29:31 GMT,2025-12-05T23:48:43.000Z,2025-12-06T03:29:31.000Z,Collin Gillespie Under 9.5 Collin Gillespie - Reb + Ast Phoenix Suns @ Houston Rockets,,Basketball,NBA
O/1509382/0000084,Fanduel Sportsbook,straight,SETTLED_LOSS,2.50,1.91,0.3095,8,-8.00,12/05/2025 16:48:42 GMT,12/06/2025 03:21:24 GMT,2025-12-05T16:48:42.000Z,2025-12-06T03:21:24.000Z,Kris Dunn Under 5.5 Kris Dunn - Reb + Ast Los Angeles Clippers @ Memphis Grizzlies,,Basketball,NBA
639005534331183974,Draftkings Sportsbook,straight,SETTLED_LOSS,1.82,1.83,-0.0075,5.98,-5.98,12/05/2025 17:43:53 GMT,12/06/2025 03:20:39 GMT,2025-12-05T17:43:53.506Z,2025-12-06T03:20:39.074Z,Under 9.5 Lonzo Ball Rebounds + Assists O/U SA Spurs @ CLE Cavaliers,,Basketball,NBA
3916438002124718367,Hard Rock Sportsbook,straight,SETTLED_LOSS,2.05,2.04,0.0049,8,-8.00,12/05/2025 13:00:53 GMT,12/06/2025 03:19:19 GMT,2025-12-05T13:00:53.842Z,2025-12-06T03:19:19.404Z,Over 7.5 Jaren Jackson Jr. - Assists + Rebounds Grizzlies vs. Clippers,,Basketball,NBA
20C24L4353,BetMGM,straight,SETTLED_WIN,2.00,1.85,0.0826,5,5.00,12/05/2025 23:16:31 GMT,12/06/2025 03:16:55 GMT,2025-12-05T23:16:31.820Z,2025-12-06T03:16:55.567Z,Over 6.5 Jerami Grant (POR) : Total assists and rebounds Portland Trail Blazers at Detroit Pistons,,Basketball,NBA
20C20ERDJH,BetMGM,straight,SETTLED_LOSS,2.05,1.91,0.0738,5,-5.00,12/05/2025 21:02:03 GMT,12/06/2025 03:16:55 GMT,2025-12-05T21:02:03.207Z,2025-12-06T03:16:55.566Z,Under 14.5 Day Day Thomas (CIN): Points Cincinnati at Xavier,,Basketball,NCAAM
